{"title": "Etiquetado Natural y Org\u00e1nico", "author": "MSU Extension", "url": "https://www.canr.msu.edu/resources/etiquetado-natural-y-org-nico", "hostname": "canr.msu.edu", "description": "Las afirmaciones de las etiquetas Natural y Org\u00e1nico se utilizan en alimentos para describir c\u00f3mo se cultivaron, criaron y/o procesaron.", "sitename": "Agriculture", "date": "2021-10-01", "cleaned_text": "Etiquetado Natural y Org\u00e1nico [DOWNLOAD](/agriculture/uploads/files/Natural & Organic Extension](/outreach) Etiquetado Natural y Org\u00e1nico Las afirmaciones de las etiquetas Natural y Org\u00e1nico se utilizan en alimentos para describir c\u00f3mo se cultivaron, criaron y/o procesaron. En Estados Unidos hay dos agencias del gobierno federal que supervisan la producci\u00f3n y el etiquetado de alimentos para garantizar que las declaraciones de la etiqueta sean veraces y no enga\u00f1osas. El Departamento de Agricultura de EE. UU. (USDA) es responsable de supervisar la carne, las aves de corral, los productos de huevo (no huevos con c\u00e1scara) y el bagre. La Administraci\u00f3n de Alimentos y Medicamentos (FDA) regula todos los dem\u00e1s alimentos, incluidos los huevos con c\u00e1scara. Natural, Totalmente Natural o 100% Natural - Definici\u00f3n del USDA: \"Un producto que no contiene ning\u00fan ingrediente artificial o color agregado y m\u00ednimamente procesado. Procesamiento m\u00ednimo significa que el producto se proces\u00f3 de una manera que no altera fundamentalmente el producto. La etiqueta debe incluir una declaraci\u00f3n que explique el significado del t\u00e9rmino natural (como \"sin ingredientes artificiales; m\u00ednimamente procesado\")\". - Definici\u00f3n de la FDA: \"No se ha incluido ni a\u00f1adido nada artificial o sint\u00e9tico (incluidos todos los aditivos de color independientemente de la fuente) en un alimento que normalmente no se esperar\u00eda que estuviera en ese alimento\". Debido a que los t\u00e9rminos \"natural\", \"totalmente natural\" o \"100% natural\" no tienen una definici\u00f3n est\u00e1ndar tanto de la FDA como del USDA, los comerciantes de alimentos pueden usar los t\u00e9rminos como lo consideren adecuado. Org\u00e1nico Los productos alimenticios org\u00e1nicos se pueden clasificar en tres categor\u00edas. Las etiquetas de los productos deben indicar el nombre del agente certificador en el panel informativo. 100% org\u00e1nico - Todos los ingredientes deben estar certificados como org\u00e1nicos - Cualquier aditivo que se a\u00f1ada, como pectina o almid\u00f3n de ma\u00edz, debe ser org\u00e1nico. Org\u00e1nico - Todos los ingredientes, excepto los especificados como permitidos en la 'Lista Nacional', deben ser certificados org\u00e1nicos. - 95% o m\u00e1s ingredientes org\u00e1nicos. Los ingredientes no org\u00e1nicos permitidos se pueden usar hasta un total combinado del 5% (excluyendo la sal y el agua). Hecho con org\u00e1nico - Al menos el 70% del producto deben ser ingredientes org\u00e1nicos certificados (excluyendo sal y agua). - No se requiere que los productos agr\u00edcolas restantes sean producidos org\u00e1nicamente, pero deben producirse sin m\u00e9todos excluidos. - Los productos no agr\u00edcolas deben estar espec\u00edficamente permitidos en la 'Lista Nacional'. Fuente: Programa Org\u00e1nico Nacional del USDA Pr\u00e1cticas de producci\u00f3n org\u00e1nica en la granja Los productores org\u00e1nicos deben seguir estrictos requisitos de producci\u00f3n y etiquetado que son supervisados y certificados por el Programa Org\u00e1nico Nacional. - Los pesticidas y fertilizantes utilizados en la producci\u00f3n de alimentos org\u00e1nicos deben ser de origen natural y no de una fuente sint\u00e9tica. - El Programa Org\u00e1nico Nacional proporciona una 'Lista Nacional' de sustancias permitidas y prohibidas. - Proh\u00edbe el uso de ingenier\u00eda gen\u00e9tica, radiaciones ionizantes y la aplicaci\u00f3n de lodos de depuraci\u00f3n. Para mayor informaci\u00f3n, visite el sitio web de Respuesta R\u00e1pida para la Agricultura de MSU Extension www.canr.msu.edu/agriculture/Rapid-Response-for-Agriculture/Consumer-Education-and-Purchasing-Local/ MSU es una instituci\u00f3n que promueve la acci\u00f3n afirmativa y la igualdad de oportunidades. Todos los programas y materiales de la oficina de Extensi\u00f3n de Michigan State University est\u00e1n disponibles sin prejuicio en virtud de raza, color, nacionalidad, sexo, minusval\u00eda, creencias religiosas, edad, caracter\u00edsticas f\u00edsicas, tendencias pol\u00edticas, estado civil, orientaci\u00f3n sexual o condici\u00f3n de veterano. "}