{"title": "Fisiocrem Gel Sport 120 Ml", "author": null, "url": "https://www.farma13.com/fisiocrem-gel-sport-120-ml", "hostname": "farma13.com", "description": "\u00bfSientes sobrecarga en tus m\u00fasculos y articulaciones despu\u00e9s de terminar una pr\u00e1ctica deportiva? Esto sucede cuando NO preparas de una manera eficaz tu cuerpo, antes de empezar, para esto esta FISIOCREM GEL SPORT, ya que es un gel de masaje deportivo con activos naturales ideal para preparar los m\u00fasculos y ligamentos antes de cualquier pr\u00e1ctica deportiva, su f\u00f3rmula est\u00e1 Basada en ingredientes naturales y contiene propiedades analg\u00e9sicas y antiinflamatorias, est\u00e1 enriquecida con un nuevo activo, que ayuda para el tratamiento de las piernas cansadas.", "sitename": "Farma13", "date": "2022-12-02", "cleaned_text": "m\u00fasculos y articulaciones despu\u00e9s de terminar una pr\u00e1ctica deportiva? Esto sucede cuando NO preparas de una manera eficaz tu cuerpo, antes de empezar, para esto esta FISIOCREM GEL SPORT, ya que es un gel de masaje deportivo con activos naturales ideal para preparar los m\u00fasculos y ligamentos antes de cualquier pr\u00e1ctica deportiva, su f\u00f3rmula est\u00e1 Basada en ingredientes naturales y contiene propiedades analg\u00e9sicas y antiinflamatorias, est\u00e1 enriquecida con un nuevo activo, que ayuda para el tratamiento de las piernas cansadas. [ ] Caracter\u00edsticas El Fisiocrem gel sport es una soluci\u00f3n de masaje r\u00e1pida y eficaz que prepara y reparar los m\u00fasculos y ligamentos en la pr\u00e1ctica deportiva, ya que activa la circulaci\u00f3n, previene el edema, reduce la inflamaci\u00f3n y ayuda a la reabsorci\u00f3n de los moratones. Beneficios - Prepara m\u00fasculos y articulaciones para prevenir lesiones deportivas. - Alivia la sensaci\u00f3n de cansancio muscular y facilita la recuperaci\u00f3n en el deportista. - Anti inflamatorio y analg\u00e9sico t\u00f3pico con activos naturales alternativa a los AINES t\u00f3picos. - Alivio de la sensaci\u00f3n de piernas cansadas para personas que trabajan muchas horas de pie. Consejos Aplicar en la zona de dolor con un ligero masaje, sin l\u00edmite de uso. Composici\u00f3n Extracto de Vara de Oro: Ayuda a prevenir el edema. Extracto de Rusco: Activa la circulaci\u00f3n sangu\u00ednea. Extracto de piel de lim\u00f3n: Evita la permeabilidad del l\u00edquido del tejido. \u00c1rnica. Cal\u00e9ndula. Hypericum. Melaleuca Precauciones Mantener fuera del alcance de los ni\u00f1os Mantener en un lugar fresco Tambi\u00e9n podr\u00eda interesarte Para esos momentos en lo que tienes alg\u00fan dolor o golpe, y necesitas aliviar al instante, tenemos para ti FISIOCREM GOLPIX ROLL ON, ya que es una soluci\u00f3n a base de extractos naturales que gracias a su efecto frescor calma y reconforta dejando una agradable sensaci\u00f3n de bienestar en la piel. Pues su pr\u00e1ctico formato roll-on facilita la aplicaci\u00f3n al... \u00bfYa conoces los beneficios y las contribuciones que hace por ti Fisiocrem Gel Active 1 Tubo 600 Ml? Esta maravillosa f\u00f3rmula est\u00e1 basada en el m\u00e9todo antiguo y tradicional de curaci\u00f3n, pero la ciencia avanza r\u00e1pidamente y nos proporciona nuevos conocimientos sobre las plantas y sus ingredientes activos que nosotros procuramos a partir de un trabajo y un... Tu Fisiocrem Viajero. \u00a1No te lo dejes en casa! Fisiocrem Gel Active 60 Ml es peque\u00f1o, lo que permitir\u00e1 que lo lleves a donde quieras. Una vez lo pruebes, se volver\u00e1 un imprescindible en tus viajes. Alivio r\u00e1pido y eficaz del dolor de los golpes o de los m\u00fasculos, articulaciones y ligamentos. Es un gel de masaje r\u00e1pido y eficaz para la preparaci\u00f3n de los... [ ](#) [ ](https://www.farma13.com/fisiocrem-musculos-y-articulaciones-1-envase-540-g) Fuera de stock \u00a1Enfr\u00e9ntate a los retos de tu vida diaria con Fisiocrem Soluble Active 480 G Sabor Naranja Mango! Es un complemento natural 100%, de sabor agradable y f\u00e1cil de tomar. Una vez lo pruebes, se volver\u00e1 un imprescindible en tu botiqu\u00edn. No s\u00f3lo por el alivio r\u00e1pido y eficaz del dolor de los m\u00fasculos y articulaciones, sino porque Fisiocrem Soluble Active... [ ](#) [ ](https://www.farma13.com/fisiocrem-gel-active-250-ml) \u00daltimas unidades en stock \u00a1Enfr\u00e9ntate a los retos de tu vida diaria con Fisiocrem Gel Active 250 Ml! Es un producto natural 100%, aroma agradable, f\u00e1cil de extender y de r\u00e1pida absorci\u00f3n. Una vez lo pruebes, se volver\u00e1 un imprescindible en tu botiqu\u00edn. No s\u00f3lo por el alivio r\u00e1pido y eficaz del dolor de los m\u00fasculos y articulaciones, sino porque Fisiocrem Gel Active 250 Ml es un... opiniones trusted producto https://www.farma13.com/fisiocrem-gel-sport-120-ml 847 Fisiocrem Gel Sport 120 Ml <p>\u00bfSientes sobrecarga en tus m\u00fasculos y articulaciones despu\u00e9s de terminar una pr\u00e1ctica deportiva? Esto sucede cuando NO preparas de una manera eficaz tu cuerpo, antes de empezar, para esto esta FISIOCREM GEL SPORT, ya que es un gel de masaje deportivo con activos naturales ideal para preparar los m\u00fasculos y ligamentos antes de cualquier pr\u00e1ctica deportiva, su f\u00f3rmula est\u00e1 Basada en ingredientes naturales y contiene propiedades analg\u00e9sicas y antiinflamatorias, est\u00e1 enriquecida con un nuevo activo, que ayuda para el tratamiento de las piernas cansadas.</p> https://www.farma13.com/8164-home_default/fisiocrem-gel-sport-120-ml.jpg 28.02 outofstock FISIOCREM 28.02 23.157 0 0 2022-12-02T10:16:28+0100 /Cremas antiinflamatorias 259 391 817 848 1398 "}