{"title": "Los hombres enferman m\u00e1s que las mujeres", "author": "QUO", "url": "https://www.libertaddigital.com/ciencia/2011-06-29/los-hombres-enferman-mas-que-las-mujeres-1276428062/", "hostname": "libertaddigital.com", "description": "Las mujeres presentan una respuesta inmune m\u00e1s fuerte que la de los hombres respecto al pat\u00f3geno rinovirus.", "sitename": "Libertad Digital", "date": "2011-06-29", "cleaned_text": "Los hombres enferman m\u00e1s que las mujeres Las mujeres presentan una respuesta inmune m\u00e1s fuerte que la de los hombres respecto al pat\u00f3geno rinovirus. Un estudio publicado en la revista [Respiratory Research](http://respiratory-research.com/) afirma que a la hora de resistir a una enfermedad, los hombres caen antes enfermos que las f\u00e9minas. Un grupo de investigadores de la Universidad de Queensland (Australia) descubri\u00f3, mediante el estudio en 63 voluntarios sanos, que el grupo perteneciente a las f\u00e9minas presentan una \"respuesta inmune m\u00e1s fuerte que la de los hombres en respuesta al pat\u00f3geno [rinovirus](http://es.wikipedia.org/wiki/Rhinovirus)\", el mismo que causa el resfriado com\u00fan que apenas dura unos d\u00edas. Seg\u00fan inform\u00f3 el director del estudio John Upham a BBC, \"nos interesaba estudiar este virus ya que es una de las razones por las que la gente con asma suele caer enferma\", por lo que inocularon el [virus](http://www.quo.es/ciencia/salud/las_nuevas_vacunas) en personas sanas para saber por qu\u00e9 este hac\u00eda tanto da\u00f1o a las personas con problemas de asma. Seg\u00fan el propio Upham, \"uno de los resultados m\u00e1s sorprendentes e interesantes que surgieron, fue que las mujeres pueden presentar una respuesta inmune mucho m\u00e1s fuerte para combatir el virus\". Pero este resultado tiene tambi\u00e9n sus contras: esta resistencia inmune en la mujer tiene fecha de caducidad: la menopausia. Esto sugiere seg\u00fan los investigadores, que las responsables de esa fortaleza en la mujer se debe a las hormonas sexuales femeninas: \"cuando estudiamos a hombres y mujeres mayores de 50 a\u00f1os, la respuesta inmune de ambos grupos era la misma\". Este hallazgo sugiere tambi\u00e9n la importancia de tener en cuenta tanto la [edad](http://www.quo.es/ciencia/salud/tu_verdadera_edad) como el sexo en los ensayos cl\u00ednicos, as\u00ed como para desarrollar nuevos tratamientos farmacol\u00f3gicos y vacunas. Agrega Upham: \"en nuestros esfuerzos para encontrar nuevas formas de prevenir estas infecciones, necesitamos tomar en cuenta los efectos de las hormonas y la forma como afectan en el sistema inmune. En Tecnociencia [Acceda a los 2 comentarios guardados](https://www.libertaddigital.com/ciencia/2011-06-29/los-hombres-enferman-mas-que-las-mujeres-1276428062/1.html) Servicios - Radarbot - Hipoteca - Libro - M\u00e1ster "}