{"title": "KUMUI cosm\u00e9tica natural", "author": "KUMI", "url": "https://www.kumuicosmeticanatural.com/", "hostname": "kumuicosmeticanatural.com", "description": "En KUMUI elaboramos cosm\u00e9tica natural eficaz de alta calidad pensada para el cuidado de tu piel y del planeta.", "sitename": "Kumui", "date": "2021-02-18", "cleaned_text": "ALTA COSM\u00c9TICA NATURAL Y POSITIVA Productos naturales y veganos centrados en la innovaci\u00f3n, calidad, bienestar interior y sostenibilidad. Mima tu piel, tu salud y tu estado de \u00e1nimo con cosm\u00e9tica positiva. La cosm\u00e9tica positiva de KUMUI se basa en la filosof\u00eda de cuidado interior, impulsada por el autorrespeto. Est\u00e1 enfocada a resultados y promueve un estilo de vida saludable, mientras celebra la belleza natural de cada persona con productos naturales y de calidad, cargados de energ\u00eda positiva. TOP VENTAS - SERUM ILUMINADOR ANTIOX C+E+FERULIC [(48)](https://www.kumuicosmeticanatural.com/tienda/producto/cosmetico-ecologico/serum-natural/serum-vitamina-c-acido-ferulico/#reviews)> Nutrici\u00f3n antioxidante d\u00eda35,00\u20ac > Luminosidad manchas > Protege de luz azul de pantallas [A\u00d1ADIR A LA CESTA](?add-to-cart=233289) - CONTORNO DE OJOS LIFT MULTIACCION [(34)](https://www.kumuicosmeticanatural.com/tienda/producto/cosmetico-ecologico/crema-hidratante-natural/contorno-ojos-cafeina/#reviews)> Acci\u00f3n reafirmante/lifting29,00\u20ac > Reduce arrugas > Trata y ojeras [A\u00d1ADIR A LA CESTA](?add-to-cart=233775) - PEELING ENZIM\u00c1TICO CON PERLAS DE JOJOBA [(38)](https://www.kumuicosmeticanatural.com/tienda/producto/cosmetico-ecologico/exfoliante-facial-natural/peeling-enzimatico-mascarilla-arcilla/#reviews)> Renueva y regenera la piel28,00\u20ac > Piel suave y luminosa > Trata manchas y arrugas [A\u00d1ADIR A LA CESTA](?add-to-cart=233928) - SERUM CORPORAL REPARACI\u00d3N Y CONFORT [(24)](https://www.kumuicosmeticanatural.com/tienda/producto/cosmetico-ecologico/serum-natural/serum-corporal-reafirmante-natural/#reviews)> Nutre profundamente35,00\u20ac > Activa la ciruclaci\u00f3n y reafirma > Antioxidante y anti-estr\u00edas [A\u00d1ADIR A LA CESTA](?add-to-cart=234209) DESC\u00daBRELO TODO Fabricaci\u00f3n KUMI or\u00edgenes Como nace la marca, quienes somos y a lo que nos comprometemos Nuestro compromiso Nuestros obetivos y los valores que nos acompa\u00f1an \u00danete a nuestra newsletter M\u00edMATE cosm\u00e9tica natural positiva y sostenible LO \u00daLTIMO DE NUESTRO BLOG [\u00bfC\u00f3mo elegir mi protector solar natural?](https://www.kumuicosmeticanatural.com/blog-belleza-natural/beautips/como-elegir-mi-protector-solar-natural/) Es bien sabido que el sol es indispensable para la vida y aporta ciertos beneficios a nuestra salud (desarrollo de vitamina D, producci\u00f3n de serotonina...). Como en todo en esta vida, los excesos nunca son buenos, y esta no es una excepci\u00f3n ;). Una sobre-exposici\u00f3n... [Cosm\u00e9tica certificada natural, vegana y ecol\u00f3gica](https://www.kumuicosmeticanatural.com/blog-belleza-natural/marca-de-cosmetica-natural/cosmetica-certificada-natural-vegana-y-ecologica/) En KUMUI Cosm\u00e9tica Natural buscamos la excelencia, tanto en la calidad de nuestros ingredientes como de nuestras formulaciones y resultados. Es por ello y por nuestro compromiso con el medioambiente, que contamos con la certificaci\u00f3n Natural, Vegana y Ecol\u00f3gica de ACENE. [KUMUI gana el Premio Andalucia ES al \"Mejor Proyecto de Nueva Creacion\"](https://www.kumuicosmeticanatural.com/blog-belleza-natural/marca-de-cosmetica-natural/kumui-gana-el-premio-andalucia-es-al-mejor-proyecto-de-nueva-creacion/) La empresa malague\u00f1a KUMUI Cosm\u00e9tica Natural gana el Premio Andaluc\u00eda ES al \"Mejor Proyecto de Nueva Creaci\u00f3n KUMUI Cosm\u00e9tica Natural ha sido reconocida por su \"creatividad, originalidad y singularidad\" La Consejer\u00eda de Empleo, Empresa y Trabajo Aut\u00f3nomo de la Junta... [C\u00f3mo proteger la piel de los cambios de temperatura bruscos](https://www.kumuicosmeticanatural.com/blog-belleza-natural/beautips/como-proteger-la-piel-de-los-cambios-de-temperatura-bruscos/) Puede que hayas notado alguna vez que tu piel perd\u00eda elasticidad, se irritaba o se secaba con alg\u00fan cambio brusco de temperatura. No te preocupes, es totalmente normal y a continuaci\u00f3n te vamos a dar unas claves b\u00e1sicas para proteger la piel de los cambios de... [La importancia de la exfoliaci\u00f3n en tu piel](https://www.kumuicosmeticanatural.com/blog-belleza-natural/beautips/kumuicosmeticanatural-com-la-importancia-de-la-exfoliacion-en-tu-piel/) Conoce la importancia de la exfoliaci\u00f3n para tu piel y aprende los trucos para hacerla en casa Es sabido por todos que la exfoliaci\u00f3n es un paso clave para mantener una piel sana, jugosa, suave, tersa e hidratada. No obstante, muchas veces no tenemos presente este... "}