{"title": "Asciende a 1.305 el balance de muertos por terremoto en Marruecos", "author": "Sputnik Mundo", "url": "https://sputniknews.lat/20230909/asciende-a-1305-el-balance-de-muertos-por-terremoto-en-marruecos-1143546747.html", "hostname": "sputniknews.lat", "description": "EL CAIRO (Sputnik) \u2014 El n\u00famero de muertos por el terremoto en Marruecos super\u00f3 los 1.300, con m\u00e1s de 1.800 personas heridas, inform\u00f3 el Ministerio del Interior del pa\u00eds.", "sitename": "Sputnik Mundo", "date": "2023-09-09", "cleaned_text": "el balance de muertos por terremoto en Marruecos Asciende a 1.305 el balance de muertos por terremoto en Marruecos EL CAIRO (Sputnik) \u2014 El n\u00famero de muertos por el terremoto en Marruecos super\u00f3 los 1.300, con m\u00e1s de 1.800 personas heridas, inform\u00f3 el Ministerio del Interior... 09.09.2023, Sputnik Mundo 2023-09-09T19:55+0000 2023-09-09T19:55+0000 2023-09-10T10:09+0000 internacional marruecos \u00e1frica terremoto en marruecos (2023) desastres naturales medioambiente /html/head/meta[@name='og:title']/@content /html/head/meta[@name='og:description']/@content https://cdn1.img.sputniknews.lat/img/07e7/09/09/1143537253_0:320:3072:2048_1920x0_80_0_0_8d4299579ad9855d4aef7c32a3c84542.jpg Previamente se informaba de 1.037 fallecidos y 1.204 heridos.El Centro Sismol\u00f3gico Europeo Mediterr\u00e1neo (EMSC, por sus siglas en ingl\u00e9s) report\u00f3 un sismo de magnitud 6,9 en Marruecos. El temblor se produjo a las 22.10 GMT del 8 de septiembre, a 80 kil\u00f3metros al suroeste de la ciudad de Marrakech con el foco situado a 10 kil\u00f3metros de profundidad.En las horas siguientes, se registraron al menos cuatro r\u00e9plicas de magnitud 4,8, 3,4, 3,2 y 3,3.El rey Mohamed VI de Marruecos declar\u00f3 tres d\u00edas de luto por las v\u00edctimas del terremoto y orden\u00f3 bajar las banderas nacionales del reino a media asta.Numerosos pa\u00edses expresaron su disposici\u00f3n para ayudar a las autoridades marroqu\u00edes tras el tr\u00e1gico desastre natural. marruecos Sputnik Mundo [ ](https://sputniknews.lat) contacto@sputniknews.com +74956456601 MIA [ [ ](https://rutube.ru/channel/24153709/) [ ](https://www.tiktok.com/@sputnik.mundo) [ ](https://www.threads.net/@sputnikmundo) marruecos, \u00e1frica, terremoto en marruecos (2023), desastres naturales, medioambiente marruecos, \u00e1frica, terremoto en marruecos (2023), desastres naturales, medioambiente Asciende a 1.305 el balance de muertos por terremoto en Marruecos [19:55 GMT 09.09.2023](/20230909/) (actualizado: 10:09 GMT 10.09.2023) EL CAIRO (Sputnik) \u2014 El n\u00famero de muertos por el terremoto en Marruecos super\u00f3 los 1.300, con m\u00e1s de 1.800 personas heridas, inform\u00f3 el Ministerio del Interior del pa\u00eds. \"El n\u00famero de muertos aument\u00f3 a 1.305, con m\u00e1s de 1.832 heridos, de los cuales 1.220 est\u00e1n en estado grave\", se\u00f1ala el comunicado, citado por el diario Hespress. Previamente se informaba de 1.037 fallecidos y 1.204 heridos. El Centro Sismol\u00f3gico Europeo Mediterr\u00e1neo (EMSC, por sus siglas en ingl\u00e9s) [report\u00f3 un sismo](https://sputniknews.lat/20230908/reportan-un-sismo-de-70-en-marruecos--videos-1143519115.html) de magnitud 6,9 en Marruecos. El temblor se produjo a las 22.10 GMT del 8 de septiembre, a 80 kil\u00f3metros al suroeste de la ciudad de Marrakech con el foco situado a 10 kil\u00f3metros de profundidad. En las horas siguientes, se registraron al menos cuatro r\u00e9plicas de magnitud 4,8, 3,4, 3,2 y 3,3. El rey Mohamed VI de Marruecos declar\u00f3 tres d\u00edas de luto por las v\u00edctimas del terremoto y orden\u00f3 bajar las banderas nacionales del reino a media asta. Numerosos pa\u00edses expresaron su disposici\u00f3n para ayudar a las autoridades marroqu\u00edes tras el tr\u00e1gico desastre natural. No te pierdas las noticias m\u00e1s importantes Suscr\u00edbete a nuestros canales de Telegram a trav\u00e9s de [estos](https://www.telegram.me/sputnikmundo) [enlaces](https://apps.ria.ru/apk/com_sputniknews_sputnik-2_0_59-145-release.apk). Ya que la aplicaci\u00f3n Sputnik est\u00e1 bloqueada en el extranjero, en [este enlace](https://apps.ria.ru/apk/com_sputniknews_sputnik-2_0_59-145-release.apk) puedes descargarla e instalarla en tu dispositivo m\u00f3vil (\u00a1solo para Android!). Tambi\u00e9n tenemos una cuenta [en "}