{"title": "Salud", "author": "Claudia Ib\u00e1\u00f1ez", "url": "https://elcaso.elnacional.cat/es/tag/salud?_page=3", "hostname": "elnacional.cat", "description": "Todas las noticias y sucesos relacionados con la salud", "sitename": "El Caso", "date": "2022-10-03", "cleaned_text": "Abusos escuela Noticias Sucesos Barcelona Sucesos Girona Sucesos Lleida Sucesos Tarragona Top 10 Qui\u00e9nes somos Qu\u00e9 hacemos D\u00f3nde estamos Cerrar sesi\u00f3n S\u00ed No Inicia sesi\u00f3n No eres miembro de ElNacional.cat? \u00danete al Club Has perdido tu contrase\u00f1a? Hay demasiados dispositivos con sesiones abiertas \u00bfQuieres cerrar las sesiones abiertas en otros dispositivos? S\u00ed No El Caso Salud Todas las noticias y sucesos relacionados con la salud Muere una enfermera hallada malherida en el p\u00e1rquing de su centro de salud en Cuenca Claudia Ib\u00e1\u00f1ez Macrobotell\u00f3n con 310 personas en la Zona Franca de Barcelona Alba Gibert Indignaci\u00f3n por un v\u00eddeo de una fiesta con 400 personas en Palafrugell Alba Gibert Muere de c\u00e1ncer en Inglaterra: operaci\u00f3n aplazada por la Covid Alba Gibert La polic\u00eda echa del bus a un hombre con autismo y le abandona en Val\u00e8ncia Jordi Mateu Pilar, la profesora que muri\u00f3 en Marbella tras la vacuna AstraZeneca Claudia Ib\u00e1\u00f1ez Ataque inform\u00e1tico en un centro m\u00e9dico: 2.000 pacientes afectados Guillem RS Fiesta con 58 personas en Badalona: v\u00eddeos promocionales en las redes Alba Gibert Mueren tres personas de Covid despu\u00e9s de compartir ambulancia para ir al hospital Claudia Ib\u00e1\u00f1ez Macrofiesta ilegal con m\u00e1s de 100 personas en una mas\u00eda de Dosrius Alba Gibert Macrobotell\u00f3n en el centro de Madrid con decenas de personas concentradas Alba Gibert Un paciente enloquecido muerde la cara a una m\u00e9dico en Brooklyn Jordi Mateu Macrofiesta ilegal en Girona: coches quemados y enfrentamientos entre los asistentes Alba Gibert Irene, una chica de Barcelona que necesita ayuda por una enfermedad Alba Gibert Hallan a un beb\u00e9 en una fiesta ilegal en Madrid Alba Gibert Macrobotell\u00f3n ilegal con m\u00e1s de 100 personas en el Born de Barcelona Alba Gibert Fiesta ilegal en una nave industrial en Vilassar de Mar Alba Gibert \u00c0lex, un chico de Poliny\u00e0 con Covid persistente: \"Es muy frustrante\" Alba Gibert V\u00edctima c\u00e1ncer por un implante de pechos: \"Me metieron veneno\" Jordi Mateu Muere una mujer americana por un trasplante de pulmones con Covid-19 Claudia Ib\u00e1\u00f1ez Un dron de la Polic\u00eda Local pilla a 138 personas haciendo botell\u00f3n Claudia Ib\u00e1\u00f1ez \u00ab "}