{"title": "Despu\u00e9s de poner tratamiento con inmunoglobulinas, \u00bfQu\u00e9 tipo de vacunas no se pueden poner y durante cu\u00e1nto tiempo?", "author": "Consejer\u00eda de Salud de la Regi\u00f3n de Murcia", "url": "http://www.murciasalud.es/preevid/3686", "hostname": "murciasalud.es", "description": "www.murciasalud.es/preevid/3686", "sitename": "BVmurciasalud", "date": "2006-05-19", "cleaned_text": "Este sitio web utiliza cookies propias y de terceros para mejorar la experiencia de navegaci\u00f3n del usuario. Las cookies utilizadas no contienen ning\u00fan tipo de informaci\u00f3n de car\u00e1cter personal. Si continua navegando entendemos que acepta su uso. Dispone de m\u00e1s informaci\u00f3n acerca de las cookies y c\u00f3mo impedir su uso en nuestra [pol\u00edtica de cookies](pagina.php?id=303977). [ ](/bvms.php?idsec=5) Incluida en el banco de preguntas el 19/05/2006. Categor\u00edas: [ Enfermedades Infecciosas, ](/preevid.php?op=banco&tema=13&idsec=453) [ Vacunas ](/preevid.php?op=banco&tema=33&idsec=453) . La informaci\u00f3n ofrecida puede no estar actualizada (es posible que nuevos estudios o publicaciones modifiquen o maticen la respuesta dada). Health professionals Servicio Murciano de Salud. Consejer\u00eda de Salud. Regi\u00f3n de Murcia Despu\u00e9s de poner tratamiento con inmunoglobulinas, \u00bfQu\u00e9 tipo de vacunas no se pueden poner y durante cu\u00e1nto tiempo? Gu\u00eda de vacunaciones del Advisory Committee on Immunization Practices (ACIP) y de la American Academy of Family Physicians (AAFP) (1) indica la necesidad de espaciar la administraci\u00f3n de la vacuna de varicela y las que contienen la vacuna del sarampi\u00f3n en ni\u00f1os que han recibido inmunoglobulinas. Un informe elaborado por la DGSP sobre contraindicaciones en la vacunaci\u00f3n infantil (2) , incluido en el programa regional de vacunaciones, desarrolla y detalla estas recomendaciones: - \"No se deben administrar inmunoglobulinas y vacuna triple v\u00edrica simult\u00e1neamente. Si fuera inevitable, administrar en sitios diferentes de inyecci\u00f3n y revacunar o evaluar seroconversi\u00f3n a los 3 meses. Si lo primero es la vacuna triple v\u00edrica, no administrar inmunoglobulina en 2 semanas. Si lo primero es la inmunoglobulina, el intervalo entre la inmunoglobulina y la vacuna triple v\u00edrica depende del producto, la dosis y la indicaci\u00f3n; oscilando de 3 a 11 meses\". (Ver Tabla incluida en el documento). - \"No vacunar de varicela por lo menos 5 meses despu\u00e9s de la administraci\u00f3n de sangre o despu\u00e9s de transfusiones de plasma, inmunoglobulina o inmunoglobulina en las 3 semanas posteriores a la vacunaci\u00f3n a menos que los beneficios superen a los de la vacuna. En esos casos, se debe revacunar 5 meses m\u00e1s tarde o evaluar inmunidad 6 meses m\u00e1s tarde y revacunar si es seronegativo\". Referencias (2): - Advisory Committee on Immunization Practice, American Academy of Family Physicians. General recommendations on immunization. MMWR Recomm Rep 2002 Feb 8;51(RR-2):1-36. [[http://www.cdc.gov/mmwr/preview/mmwrhtml/rr5102a1.htm]](http://www.cdc.gov/mmwr/preview/mmwrhtml/rr5102a1.htm) [Consulta: 27/10/2010] - Direcci\u00f3n General de Salud P\u00fablica. Contraindicaciones en vacunaciones Infantiles. Consejer\u00eda de Sanidad. Regi\u00f3n de Murcia. [[https://www.murciasalud.es/archivo.php?id=9186]](https://www.murciasalud.es/archivo.php?id=9186) [Consulta: 27/10/2010] Estas referencias son del tipo: - Cohortes, casos controles, serie de casos cl\u00ednicos: 0 referencia - Sumario de evidencia: 0 referencia - Informaci\u00f3n/ material de ayuda para pacientes: 0 referencia - Cap\u00edtulo de libro: 0 referencia - Gu\u00edas de pr\u00e1ctica cl\u00ednica: 2 referencias - Metaan\u00e1lisis y/o revisiones sistem\u00e1ticas: 0 referencia - Ensayos cl\u00ednicos: 0 referencia - Consenso de profesionales: 0 referencia M\u00e1s Informaci\u00f3n Pregunta contestada por [Centro Tecnol\u00f3gico de Informaci\u00f3n y Documentaci\u00f3n Sanitarias](/preevid.php?op=faq&idsec=453) Cita recomendada Banco de Preguntas Preevid. Despu\u00e9s de poner tratamiento con inmunoglobulinas, \u00bfQu\u00e9 tipo de vacunas no se pueden poner y durante cu\u00e1nto tiempo? Murciasalud, 2006. Disponible en http://www.murciasalud.es/preevid/3686 Advertencia sobre la utilizaci\u00f3n de las respuestas Las contestaciones a las preguntas formuladas, se elaboran con una finalidad exclusivamente formativa. Lo que se pretende, es contribuir con informaci\u00f3n al enriquecimiento y actualizaci\u00f3n del proceso deliberativo de los profesionales de la Medicina y de la Enfermer\u00eda. Nunca deber\u00e1n ser usadas como criterio \u00fanico o fundamental para el establecimiento de un determinado diagn\u00f3stico o la adopci\u00f3n de una pauta terap\u00e9utica concreta. De ning\u00fan modo se pretende sustituir, avalar o tutelar la responsabilidad del m\u00e9dico. Esta deriva de sus propias decisiones y s\u00f3lo por \u00e9l debe ser asumida, no pudiendo ser compartida por quienes s\u00f3lo le han informado. La Consejer\u00eda de Salud y el Servicio Murciano de Salud, rechazan a priori toda responsabilidad respecto de cualquier da\u00f1o o perjuicio que se pueda imputar a la utilizaci\u00f3n total o parcial de la informaci\u00f3n aportada y que fue solicitada previamente por el profesional m\u00e9dico o de enfermer\u00eda. [ ](/principal.php) (c) Consejer\u00eda de Salud de la Regi\u00f3n de Murcia Contacto: Ronda de Levante, 11, 30008, "}