{"title": "2023 Complementary and Alternative Medicine Market Size and Growth | Market Dynamics and New Developments till 2030", "author": "The Express Wire", "url": "https://www.benzinga.com/pressreleases/23/08/34142709/2023-complementary-and-alternative-medicine-market-size-and-growth-market-dynamics-and-new-developm", "hostname": "benzinga.com", "description": "The Global \"Complementary and Alternative Medicine Market\" Informational Report provides an in-depth examination of market dynamics to help businesses make strategic decisions. It facilitates trend anticipation by", "sitename": "Benzinga", "date": "2023-08-31", "cleaned_text": "The Global \" [Complementary and Alternative Medicine Market](https://www.absolutereports.com/enquiry/request-sample/21703354)\" Informational Report provides an in-depth examination of market dynamics to help businesses make strategic decisions. It facilitates trend anticipation by assessing major key players performance, profiles, growth prospects, and regional impacts. This research equips organizations with the knowledge they need to understand the landscape of the Complementary and Alternative Medicine market and obtain a competitive advantage through wise decisions. The research includes a thorough analysis of the key growth-promoting variables, the strategic stances taken by economic actors, and the chances for expansion based on market dynamics globally and at the regional level. It offers a thorough grasp of the entire ecosystem, together with in-depth knowledge of important market categories and the impact they have on particular regions. The report also looks into recent technology developments and research and development expenditures made by well-known companies. It includes essential elements like such as size, application, market share, supply chain, revenue trends, offering a thorough investigation of these factors throughout the report. Market Analysis and Insights: Global Complementary and Alternative Medicine Market The global Complementary and Alternative Medicine market size was valued at USD 132318.51 million in 2021 and is expected to expand at a CAGR of 21.94% during the forecast period, reaching USD 435020.27 million by 2027. Major Players in Complementary and Alternative Medicine market are: - Iyengar Yoga Institute - John Schumachers Unity Woods Yoga Center - Helio USA - Quantum Touch - Herbal Hills - Yoga Tree - Herb Pharm - The Healing Company - Columbia Nutritional - Pure encapsulations - Deepure Plus - Nordic Naturals Get a Sample Copy of the report: [https://www.absolutereports.com/enquiry/request-sample/21703354](https://www.absolutereports.com/enquiry/request-sample/21703354) Complementary and Alternative Medicine Market by Types: - Botanicals - Acupuncture - Mind, Body, and Yoga - Magnetic Intervention Complementary and Alternative Medicine Market by Applications: - Direct Contact - E-training - Distance Correspondence Complementary and Alternative Medicine Market Key Points: - Define, describe and forecast Complementary and Alternative Medicine product market by type, application, end user and region. - Provide enterprise external environment analysis and PEST analysis. - Provide strategies for company to deal with the impact of COVID-19. - Provide market dynamic analysis, including market driving factors, market development constraints. - Provide market entry strategy analysis for new players or players who are ready to enter the market, including market segment definition, client analysis, distribution model, product messaging and positioning, and price strategy analysis. - Keep up with international market trends and provide analysis of the impact of the COVID-19 epidemic on major regions of the world. - Analyze the market opportunities of stakeholders and provide market leaders with details of the competitive landscape. To Understand How Covid-19 Impact Is Covered in This Report - [https://www.absolutereports.com/enquiry/request-covid19/21703354](https://www.absolutereports.com/enquiry/request-covid19/21703354) Geographically, the detailed analysis of consumption, revenue, market share and growth rate, historical data and forecast : - United States - Europe - China - Japan - India - Southeast Asia - Latin America - Middle East and Africa Outline Chapter 1 mainly defines the market scope and introduces the macro overview of the industry, with an executive summary of different market segments ((by type, application, region, etc.), including the definition, market size, and trend of each market segment. Chapter 2 provides a qualitative analysis of the current status and future trends of the market. Industry Entry Barriers, market drivers, market challenges, emerging markets, consumer preference analysis, together with the impact of the COVID-19 outbreak will all be thoroughly explained. Chapter 3 analyzes the current competitive situation of the market by providing data regarding the players, including their sales volume and revenue with corresponding market shares, price and gross margin. In addition, information about market concentration ratio, mergers, acquisitions, and expansion plans will also be covered. Chapter 4 focuses on the regional market, presenting detailed data (i.e., sales volume, revenue, price, gross margin) of the most representative regions and countries in the world. Chapter 5 provides the analysis of various market segments according to product types, covering sales volume, revenue along with market share and growth rate, plus the price analysis of each type. Chapter 6 shows the breakdown data of different applications, including the consumption and revenue with market share and growth rate, with the aim of helping the readers to take a close-up look at the downstream market. Chapter 7 provides a combination of quantitative and qualitative analyses of the market size and development trends in the next five years. The forecast information of the whole, as well as the breakdown market, offers the readers a chance to look into the future of the industry. Chapter 8 is the analysis of the whole market industrial chain, covering key raw materials suppliers and price analysis, manufacturing cost structure analysis, alternative product analysis, also providing information on major distributors, downstream buyers, and the impact of COVID-19 pandemic. Chapter 9 shares a list of the key players in the market, together with their basic information, product profiles, market performance (i.e., sales volume, price, revenue, gross margin), recent development, SWOT analysis, etc. Chapter 10 is the conclusion of the report which helps the readers to sum up the main findings and points. Chapter 11 introduces the market research methods and data sources. Major Questions Addressed in the Report: - What is the anticipated growth rate of the Complementary and Alternative Medicine market and what factors are influencing this growth in the next years? - What is the market's perception and adoption rate of the various kinds of Complementary and Alternative Medicines? - How are government initiatives and regulatory measures influencing the expansion of the Complementary and Alternative Medicine market? - What are the top 5 competitors' market shares, and how are they projected to change over the next few years? - What new developments and technology are there in the Complementary and Alternative Medicine market, and how are they changing the business environment? - What impact do macroeconomic variables like GDP, inflation, and exchange rates have on the Complementary and Alternative Medicine market? - What are the supply chain and logistical issues the participants in the Complementary and Alternative Medicine market are dealing with? - How are the dynamics of the Complementary and Alternative Medicine market being impacted by shifting customer behaviour and preferences? - What potential dangers and pitfalls could accompany investing in the Complementary and Alternative Medicine market, and how can they be avoided? Inquire or Share Your Questions If Any before the Purchasing This Report - [https://www.absolutereports.com/enquiry/pre-order-enquiry/21703354](https://www.absolutereports.com/enquiry/pre-order-enquiry/21703354) Detailed TOC of Global Complementary and Alternative Medicine Industry Research Report 1 Complementary and Alternative Medicine Market Overview 1.1 Product Overview and Scope of Complementary and Alternative Medicine Market 1.2 Complementary and Alternative Medicine Market Segment by Type 1.2.1 Global Market Sales Volume and CAGR (Percentage) Comparison by Type (2018-2028) 1.3 Global Complementary and Alternative Medicine Market Segment by Application 1.3.1 Market Consumption (Sales Volume) Comparison by Application (2018-2028) 1.4 Global Complementary and Alternative Medicine Market, Region Wise (2018-2028) 1.4.1 Global Market Size (Revenue) and CAGR (Percentage) Comparison by Region (2018-2028) 1.4.2 United States Complementary and Alternative Medicine Market Status and Prospect (2018-2028) 1.4.3 Europe Complementary and Alternative Medicine Market Status and Prospect (2018-2028) 1.4.4 China Complementary and Alternative Medicine Market Status and Prospect (2018-2028) 1.4.5 Japan Complementary and Alternative Medicine Market Status and Prospect (2018-2028) 1.4.6 India Complementary and Alternative Medicine Market Status and Prospect (2018-2028) 1.4.7 Southeast Asia Complementary and Alternative Medicine Market Status and Prospect (2018-2028) 1.4.8 Latin America Complementary and Alternative Medicine Market Status and Prospect (2018-2028) 1.4.9 Middle East and Africa Complementary and Alternative Medicine Market Status and Prospect (2018-2028) 1.5 Global Market Size of Complementary and Alternative Medicine (2018-2028) 1.5.1 Global Complementary and Alternative Medicine Market Revenue Status and Outlook (2018-2028) 1.5.2 Global Complementary and Alternative Medicine Market Sales Volume Status and Outlook (2018-2028) 1.6 Global Macroeconomic Analysis 1.7 The impact of the Russia-Ukraine war on the Complementary and Alternative Medicine Market 2 Industry Outlook 2.1 Complementary and Alternative Medicine Industry Technology Status and Trends 2.2 Industry Entry Barriers 2.2.1 Analysis of Financial Barriers 2.2.2 Analysis of Technical Barriers 2.2.3 Analysis of Talent Barriers 2.2.4 Analysis of Brand Barrier 2.3 Complementary and Alternative Medicine Market Drivers Analysis 2.4 Complementary and Alternative Medicine Market Challenges Analysis 2.5 Emerging Market Trends 2.6 Consumer Preference Analysis 2.7 Complementary and Alternative Medicine Industry Development Trends under COVID-19 Outbreak 2.7.1 Global COVID-19 Status Overview 2.7.2 Influence of COVID-19 Outbreak on Complementary and Alternative Medicine Industry Development [Get a Sample Copy of the Complementary and Alternative Medicine Market Report ](https://www.absolutereports.com/enquiry/request-sample/21703354) 3 Global Complementary and Alternative Medicine Market Landscape by Player 3.1 Global Sales Volume and Share by Player (2018-2023) 3.2 Global Revenue and Market Share by Player (2018-2023) 3.3 Global Average Price by Player (2018-2023) 3.4 Global Gross Margin by Player (2018-2023) 3.5 Complementary and Alternative Medicine Market Competitive Situation and Trends 3.5.1 Complementary and Alternative Medicine Market Concentration Rate 3.5.2 Complementary and Alternative Medicine Market Share of Top 3 and Top 6 Players 3.5.3 Mergers and Acquisitions, Expansion 4 Global Complementary and Alternative Medicine Sales Volume and Revenue Region Wise (2018-2023) 4.1 Global Sales Volume and Market Share, Region Wise (2018-2023) 4.2 Global Revenue and Market Share, Region Wise (2018-2023) 4.3 Global Sales Volume, Revenue, Price and Gross Margin (2018-2023) 4.4 United States Sales Volume, Revenue, Price and Gross Margin (2018-2023) 4.4.1 United States Market Under COVID-19 4.5 Europe Sales Volume, Revenue, Price and Gross Margin (2018-2023) 4.5.1 Europe Market Under COVID-19 4.6 China Sales Volume, Revenue, Price and Gross Margin (2018-2023) 4.6.1 China Market Under COVID-19 4.7 Japan Sales Volume, Revenue, Price and Gross Margin (2018-2023) 4.7.1 Japan Market Under COVID-19 4.8 India Sales Volume, Revenue, Price and Gross Margin (2018-2023) 4.8.1 India Market Under COVID-19 4.9 Southeast Asia Sales Volume, Revenue, Price and Gross Margin (2018-2023) 4.9.1 Southeast Asia Market Under COVID-19 4.10 Latin America Sales Volume, Revenue, Price and Gross Margin (2018-2023) 4.10.1 Latin America Market Under COVID-19 4.11 Middle East and Africa Sales Volume, Revenue, Price and Gross Margin (2018-2023) 4.11.1 Middle East and Africa Market Under COVID-19 5 Global Complementary and Alternative Medicine Sales Volume, Revenue, Price Trend by Type 5.1 Global Sales Volume and Market Share by Type (2018-2023) 5.2 Global Revenue and Market Share by Type (2018-2023) 5.3 Global Price by Type (2018-2023) 5.4 Global Sales Volume, Revenue and Growth Rate by Type (2018-2023) 6 Global Complementary and Alternative Medicine Market Analysis by Application 6.1 Global Consumption and Market Share by Application (2018-2023) 6.2 Global Consumption Revenue and Market Share by Application (2018-2023) 6.3 Global Consumption and Growth Rate by Application (2018-2023) 7 Global Complementary and Alternative Medicine Market Forecast (2023-2028) 7.1 Global Sales Volume, Revenue Forecast (2023-2028) 7.1.1 Global Sales Volume and Growth Rate Forecast (2023-2028) 7.1.2 Global Revenue and Growth Rate Forecast (2023-2028) 7.1.3 Global Price and Trend Forecast (2023-2028) 7.2 Global Sales Volume and Revenue Forecast, Region Wise (2023-2028) 7.2.1 United States Sales Volume and Revenue Forecast (2023-2028) 7.2.2 Europe Sales Volume and Revenue Forecast (2023-2028) 7.2.3 China Sales Volume and Revenue Forecast (2023-2028) 7.2.4 Japan Sales Volume and Revenue Forecast (2023-2028) 7.2.5 India Sales Volume and Revenue Forecast (2023-2028) 7.2.6 Southeast Asia Sales Volume and Revenue Forecast (2023-2028) 7.2.7 Latin America Sales Volume and Revenue Forecast (2023-2028) 7.2.8 Middle East and Africa Sales Volume and Revenue Forecast (2023-2028) 7.3 Global Sales Volume, Revenue and Price Forecast by Type (2023-2028) 7.4 Global Complementary and Alternative Medicine Consumption Forecast by Application (2023-2028) 7.5 Complementary and Alternative Medicine Market Forecast Under COVID-19 8 Complementary and Alternative Medicine Market Upstream and Downstream Analysis 8.1 Complementary and Alternative Medicine Industrial Chain Analysis 8.2 Key Raw Materials Suppliers and Price Analysis 8.3 Manufacturing Cost Structure Analysis 8.3.1 Labor Cost Analysis 8.3.2 Energy Costs Analysis 8.3.3 RandD Costs Analysis 8.4 Alternative Product Analysis 8.5 Major Distributors of Complementary and Alternative Medicine Analysis 8.6 Major Downstream Buyers of Complementary and Alternative Medicine Analysis 8.7 Impact of COVID-19 and the Russia-Ukraine war on the Upstream and Downstream in the Complementary and Alternative Medicine Industry 9 Players Profiles 9.1 Manufacture 1 9.1.1 Manufacture 1 Basic Information, Manufacturing Base, Sales Region and Competitors 9.1.2 Complementary and Alternative Medicine Product Profiles, Application and Specification 9.1.3 Manufacture 1 Market Performance (2018-2023) 9.1.4 Recent Development 9.1.5 SWOT Analysis 10 Research Findings and Conclusion 11 Appendix 11.1 Methodology 11.2 Research Data Source Purchase this Report (Price 3250 USD for a Single-User License) - [https://www.absolutereports.com/purchase/21703354](https://www.absolutereports.com/purchase/21703354) Contact Us: Absolute Reports Phone : US +1 424 253 0807 UK +44 203 239 8187 Email : [sales@absolutereports.com](mailto:sales@absolutereports.com) Web : [https://www.absolutereports.com](https://www.absolutereports.com) Press Release Distributed by [ The Express Wire ](http://www.theexpresswire.com/) To view the original version on The Express Wire visit [2023 Complementary and Alternative Medicine Market Size and Growth | Market Dynamics and New Developments till 2030](https://www.theexpresswire.com/pressrelease/2023-Complementary-and-Alternative-Medicine-Market-Size-and-Growth-Market-Dynamics-and-New-Developments-till-2030_23073115) COMTEX_439303447/2598/2023-08-31T08:40:12 \u00a9 2023 Benzinga.com. Benzinga does not provide investment advice. All rights reserved. "}