{"title": "Reflexiones respecto a plantas medicinales y su ense\u00f1anza en medicina", "author": "Universidad Nacional Aut\u00f3noma de M\u00e9xico; Figueroa Hernandez; Jose Luis", "url": "https://repositorio.unam.mx/contenidos/5041007", "hostname": "unam.mx", "description": "Repositorio Institucional de la UNAM", "sitename": "Universidad Nacional Aut\u00f3noma de M\u00e9xico", "date": "2009-09-10", "cleaned_text": "https://www.ru.tic.unam.mx/handle/123456789/7 351.#.#.b: Revista Digital Universitaria 351.#.#.a: 883.#.#.a: Repositorio de la Direcci\u00f3n General de C\u00f3mputo y de Tecnolog\u00edas de Informaci\u00f3n y Comunicaci\u00f3n \"RU-TIC\" 590.#.#.a: Administraci\u00f3n Central 883.#.#.1: https://www.tic.unam.mx/ 883.#.#.q: Direcci\u00f3n General de C\u00f3mputo y de Tecnolog\u00edas de Informaci\u00f3n y Comunicaci\u00f3n, UNAM 850.#.#.a: Universidad Nacional Aut\u00f3noma de M\u00e9xico 856.4.0.u: https://ru.tic.unam.mx/bitstream/123456789/1533/1/art55_2009.pdf 100.1.#.a: cvu:206563 524.#.#.a: Figueroa Hernandez, Jose Luis (2009). Reflexiones respecto a plantas medicinales y su ense\u00f1anza en medicina. Coordinaci\u00f3n de Universidad Abierta, Innovaci\u00f3n Educativa y Educaci\u00f3n a Distancia, UNAM; Direcci\u00f3n General de C\u00f3mputo y de Tecnolog\u00edas de Informaci\u00f3n y Comunicaci\u00f3n, UNAM. Recuperado de https://repositorio.unam.mx/contenidos/5041007 245.1.0.a: Reflexiones respecto a plantas medicinales y su ense\u00f1anza en medicina 502.#.#.c: Universidad Nacional Aut\u00f3noma de M\u00e9xico 561.1.#.a: Direcci\u00f3n General de C\u00f3mputo y de Tecnolog\u00edas de Informaci\u00f3n y Comunicaci\u00f3n, UNAM 264.#.0.c: 2009 264.#.1.c: 2009-09-10 307.#.#.a: La titularidad de los derechos patrimoniales de esta obra pertenece a la Universidad Nacional Aut\u00f3noma de M\u00e9xico. Su uso se rige por una licencia Creative Commons BY-NC-SA 4.0 Internacional, https://creativecommons.org/licenses/by-nc-sa/4.0/legalcode.es, fecha de asignaci\u00f3n de la licencia 2018-06-28, para un uso diferente consultar al responsable jur\u00eddico del repositorio por medio del correo electr\u00f3nico rutic@unam.mx 884.#.#.k: http://ru.tic.unam.mx/handle/123456789/1533 001.#.#.#: oai:ru.tic.unam.mx:123456789/1533 041.#.7.h: spa 520.3.#.a: Una de las fuentes m\u00e1s antiguas del origen de medicamentos, indiscutiblemente, han sido las especies vegetales. Casi todos los pueblos del planeta, usan vegetales, como fuentes antiguas y modernas de \"medicamentos\". En M\u00e9xico, el C\u00f3dice de la Cruz-Badiano es una evidencia. La fitomedicina y los fitof\u00e1rmacos han tenido un intenso desarrollo internacional. En M\u00e9xico, a los productos derivados de las plantas no se les denomina medicamentos, por lo que su regulaci\u00f3n pasa al rubro de complementos alimenticios, y se expenden sin receta m\u00e9dica en gran cantidad. Es necesario realizar su evaluaci\u00f3n fitofarmacol\u00f3gica para garantizar los efectos ben\u00e9ficos y la seguridad para los consumidores. Las autoridades de la Secretar\u00eda de Salud requieren esta clase de informaci\u00f3n para registrar los productos como medicamentos. Sin embargo, en la ense\u00f1anza-aprendizaje de la Medicina Occidental, alop\u00e1tica o cient\u00edfica, se ha dejado de lado el abordaje de las \"medicinas alternativas\", entre ellas de la herbolaria. Por tanto, es aconsejable que la herbolaria sea incluida en los programas acad\u00e9micos de las facultades de medicina, cuando est\u00e9 disponible la evidencia cient\u00edfica del mecanismo de acci\u00f3n de los productos herbolarios, con el prop\u00f3sito de que los estudiantes sepan acerca del tratamiento con \"plantas\" que los pacientes est\u00e1n utilizando y cu\u00e1les pueden ser de valor; One of more ancient origin of drugs has been vegetable species. Almost all people in the earth use vegetables as ancient and modern origin drugs. At M\u00e9xico, De la Cruz-Badiano codex is a evidence. Phyto-medicine and Phytopharmacology has suffered an intensive international development. At M\u00e9xico, products from plant origin are not named drugs, instead are called food supplements, they are sold without prescription and are marketed in consumers. Authorities of the Health Ministry require this kind of information to register the products as drugs. However, Alternative medicines, as allopathic, medicine schools. Therefore, it would be advisable that folk medicine be included in the Academic Program of Medical School at National University of Mexico, when evidence of mechanisms of action of plant products are available, in order that graduates know what treatments with plants patients are using and those that may be of valu. 500.#.#.a: Tema del mes. Universidad Abierta, Innovaci\u00f3n Educativa y Educaci\u00f3n a Distancia, UNAM; Direcci\u00f3n General de C\u00f3mputo y de Tecnolog\u00edas de Informaci\u00f3n y Comunicaci\u00f3n, UNAM 900.#.#.a: http://www.revista.unam.mx/vol.10/num9/art55/art55.pdf 900.#.#.c: Revista Digital Universitaria license_type: by-nc-sa No entro en nada No entro en nada 2 "}