{"title": "40 consejos de salud que nunca debes seguir", "author": "Korin Miller", "url": "https://www.esquire.com/es/salud-fitness-running/g40402364/peores-consejos-salud/", "hostname": "esquire.com", "description": "En serio, haz caso a nuestros consejos e ignora todo lo que te vamos a contar.", "sitename": "Esquire", "date": "2022-06-25", "cleaned_text": "40 consejos de salud que nunca debes seguir En serio, haz caso a nuestros consejos e ignora todo lo que te vamos a contar. [Korin Miller](/es/author/219867/korin-miller/) - [Los 25 mejores alimentos para perder peso](https://www.esquire.com/es/salud-fitness-running/g38897766/que-comer-para-perder-peso/) - [\u00bfPueden las vitaminas ayudarte a perder peso? Analizamos los suplementos m\u00e1s populares](https://www.esquire.com/es/salud-fitness-running/a38656605/vitaminas-perder-peso-adelgazar-suplementos/) - [11 maneras de perder peso cuando te has estancado en tu dieta](https://www.esquire.com/es/salud-fitness-running/a33530081/como-adelgazar-perder-peso-dieta/) Cuando se trata de estar sano, uno trata de hacerlo lo mejor posible. Pero puede ser dif\u00edcil saber lo que debes y no debes hacer cuando te bombardean constantemente con consejos de salud de todas las direcciones. Resulta que algunas de las cosas m\u00e1s comunes y antiguas que has escuchado o le\u00eddo por todo Internet son en realidad... err\u00f3neas. Estos son 40 de los \"peores\" consejos de salud que nunca deber\u00edas seguir, y por qu\u00e9. Tienes que afeitarte el vello p\u00fabico El vello p\u00fabico tiene un prop\u00f3sito: est\u00e1 dise\u00f1ado para proteger la vagina y tambi\u00e9n ayuda a evitar la irritaci\u00f3n por la fricci\u00f3n durante las relaciones sexuales. Si lo haces o no, afeitarte ah\u00ed abajo es, en \u00faltima instancia, una preferencia personal. No tienes por qu\u00e9 afeitarte ah\u00ed abajo si no quieres. Deber\u00edas probar una dieta de eliminaci\u00f3n para perder peso No es as\u00ed. Una dieta de eliminaci\u00f3n es justo lo que parece: Consiste en eliminar ciertos alimentos de la dieta. Pero est\u00e1 dise\u00f1ada para ayudar a descubrir si tienes alguna intolerancia o alergia alimentaria, no para perder peso. Puedes utilizar el m\u00e9todo de la marcha atr\u00e1s para no quedarte embarazada Se trata de un gran mito que puede tener graves consecuencias. Este m\u00e9todo de extracci\u00f3n no es infalible. De hecho, alrededor del 4% de las parejas se quedan embarazadas si el var\u00f3n se retira antes de eyacular, seg\u00fan una investigaci\u00f3n publicada en la revista [Contraception](https://www.guttmacher.org/sites/default/files/pdfs/pubs/journals/reprints/Contraception79-407-410.pdf). Para perder peso, hay que centrarse en el ejercicio en lugar de la dieta La gente ha argumentado esto durante a\u00f1os, pero las investigaciones sugieren lo contrario. La raz\u00f3n por la que las dietas son mucho m\u00e1s efectivas que el ejercicio es porque se necesita mucha actividad para crear un d\u00e9ficit de 500 a 700 calor\u00edas diarias que se necesitar\u00edan para perder medio kilo en una semana haciendo ejercicio. Eso no significa que el ejercicio no sea importante, lo es. Pero es crucial comer bien cuando el objetivo es perder peso. No comas antes de acostarte para evitar el aumento de peso No, en realidad no tienes que preocuparte tanto por seguir este consejo. Algunos estudios sugieren lo contrario, que comer un tentempi\u00e9 antes de acostarse puede ayudarte a sentirte m\u00e1s saciado y a comer menos en general. Pero en realidad no hay datos convincentes que demuestren que comer justo antes de acostarse sea un factor significativo en el aumento de peso -o en la p\u00e9rdida de peso-. Sigue tus se\u00f1ales de hambre y come cuando necesites combustible. En lo que respecta al riesgo de Alzheimer, lo primero que hay que hacer es preocuparse por la gen\u00e9tica. S\u00ed, tener un familiar con la enfermedad de Alzheimer puede aumentar el riesgo de padecerla en el futuro. Pero los factores relacionados con el estilo de vida tambi\u00e9n desempe\u00f1an un papel importante. La dieta, el ejercicio y el sue\u00f1o pueden ayudarte a retrasar o incluso evitar la degeneraci\u00f3n cerebral asociada al Alzheimer, y son factores que t\u00fa puede controlar. Al\u00e9jate por completo del caf\u00e9 cuando est\u00e9s embarazada El problema es la cafe\u00edna, y los expertos est\u00e1n de acuerdo en que un poco de cafe\u00edna (incluido el caf\u00e9) est\u00e1 bien cuando se est\u00e1 embarazada. El consenso cient\u00edfico general es que consumir m\u00e1s de 300 miligramos de cafe\u00edna al d\u00eda puede aumentar el riesgo de p\u00e9rdida del embarazo y de tener un beb\u00e9 con bajo peso al nacer, seg\u00fan la Organizaci\u00f3n Mundial de la Salud. Por eso, el [Colegio Estadounidense de Obstetras y Ginec\u00f3logos](https://www.acog.org/Patients/FAQs/Nutrition-During-Pregnancy) recomienda a las mujeres embarazadas que consuman menos de 200 miligramos de cafe\u00edna al d\u00eda, es decir, unas ocho onzas de caf\u00e9. Si te pasas al descafeinado, puedes tomar incluso m\u00e1s. Tienes que llamar siempre a tu m\u00e9dico sobre el manchado del periodo Claro que no es lo ideal, pero no significa necesariamente que algo vaya mal en tu salud. En cambio, podr\u00eda significar algo tan simple como que tu patr\u00f3n de ovulaci\u00f3n est\u00e1 un poco desviado o que tu cuerpo se est\u00e1 adaptando a un nuevo anticonceptivo. Sin embargo, si persiste, habla con tu m\u00e9dico. Para acabar con la resaca lo antes posible, toma una bebida deportiva Ciertas bebidas \"pueden\" ayudar a reponer los electrolitos -sodio, potasio, f\u00f3sforo, cloro, calcio y magnesio- y, en general, a regular los niveles de l\u00edquidos en el organismo. Pero la mayor\u00eda de las resacas no est\u00e1n relacionadas con un desequilibrio de electrolitos. As\u00ed que, aunque las bebidas deportivas pueden ayudarte a rehidratarte, es poco probable que te curen la resaca por arte de magia. Ducha vaginal Tu vagina es como un horno de autolimpieza. Tiene un delicado microbioma que se esfuerza por mantenerse sano. Las duchas vaginales lo estropean y pueden aumentar el riesgo de desarrollar ciertas infecciones. As\u00ed que no lo hagas. Para limpiar una herida, sum\u00e9rgela en agua salada En realidad, es lo contrario. El agua salada, como la que se encuentra en la playa o te puedes hacer en casa, no es est\u00e9ril y puede contener bacterias nocivas, incluidas las que se comen la carne. Eso puede exponerte a una infecci\u00f3n grave. Consulta a tu m\u00e9dico lo antes posible sobre los co\u00e1gulos de la regla No es necesario que despiertes a tu ginec\u00f3logo en mitad de la noche por los co\u00e1gulos de sangre de la regla. Es completamente normal. Por lo general, los anticoagulantes que libera el cuerpo cuando se tiene el periodo evitan los co\u00e1gulos de sangre del periodo. Pero a veces -especialmente si tienes un flujo abundante- no se puede descomponer todo el tejido uterino. Esto puede hacer que se formen co\u00e1gulos y se liberen durante el periodo. Aunque no todas las mujeres experimentan co\u00e1gulos, es normal tenerlos. Bebe vinagre de sidra de manzana cuando est\u00e9s resfriado La gente afirma que beber una soluci\u00f3n diluida de vinagre de sidra de manzana cambiar\u00e1 los niveles de pH de tu cuerpo para crear un ambiente donde las bacterias y los virus no pueden vivir. Esto no est\u00e1 probado. Los efectos de este vinagre se han estudiado en las bacterias que est\u00e1n fuera del cuerpo, pero se desconoce c\u00f3mo funciona en las bacterias dentro del cuerpo. Adem\u00e1s, la mayor\u00eda de los resfriados son causados por virus, no por bacterias, lo que significa que no va a hacer mucho de todos modos. S\u00f3lo hay que tomar vitaminas prenatales cuando se est\u00e1 embarazada Las vitaminas prenatales est\u00e1n pensadas para suplir las carencias nutricionales y garantizar la abundancia de todos los nutrientes vitales que el beb\u00e9 necesita para crecer. Lo ideal es que empieces a tomarlas en cuanto empieces a intentar concebir, ya que tu beb\u00e9 necesitar\u00e1 esos nutrientes adicionales desde el momento de la concepci\u00f3n. Muchos m\u00e9dicos tambi\u00e9n recomiendan que las madres lactantes tomen tambi\u00e9n vitaminas prenatales para ayudar a cubrir las carencias nutricionales. No te molestes en vacunarte contra la gripe S\u00ed, la vacuna antigripal es m\u00e1s eficaz para prevenir la gripe en algunos a\u00f1os que en otros. Pero vacunarse contra la gripe tambi\u00e9n puede reducir el riesgo de desarrollar complicaciones graves de la gripe, y ayudar a asegurar que tendr\u00e1s un curso m\u00e1s suave de la enfermedad si llegas a contraerla. As\u00ed pues, vac\u00fanate contra la gripe. Debes esperar sentirte agotada durante tu periodo Seguramente no te sentir\u00e1s estupenda las 24 horas del d\u00eda durante tu periodo, pero sentirte siempre cansada puede ser una se\u00f1al de que algo no va bien. Si tus periodos tienden a ser abundantes o a durar m\u00e1s de siete d\u00edas, podr\u00edas desarrollar una anemia ferrop\u00e9nica, una afecci\u00f3n que se produce cuando tienes muy poco hierro en tu cuerpo. Seg\u00fan el Departamento de Salud y Servicios Humanos de EE.UU., la anemia puede acabar con tu energ\u00eda, hacerte sentir d\u00e9bil y provocar falta de aliento. Si esto te describe cuando llega ese momento del mes, llama a tu m\u00e9dico. Hazte una envoltura corporal para perder peso r\u00e1pidamente La gente afirma que las envolturas corporales pueden ayudarte a perder kilos r\u00e1pidamente, pero no es el tipo de p\u00e9rdida de peso que buscas. Las envolturas corporales podr\u00edan hacerte parecer m\u00e1s delgado e incluso podr\u00edan hacerte perder algunos kilos, pero todo se deber\u00e1 a la p\u00e9rdida de peso del agua y, por lo tanto, ser\u00e1 temporal. Debes tomar c\u00farcuma para tener una mente aguda La c\u00farcuma es antiinflamatoria y act\u00faa como antioxidante. Pero aunque mucha gente afirma que puede agudizar la mente y evitar el Alzheimer, no hay pruebas cient\u00edficas que lo respalden. No es necesario lavarse los pies en la ducha Cuando te duchas, el agua y el jab\u00f3n bajan por las piernas y llegan a los pies, por lo que parece que la zona est\u00e1 cubierta. Pero no tienes permiso para no lavarte los pies en la ducha: acumulan mucha suciedad y no les vendr\u00eda mal una buena limpieza. Deber\u00edas seguir con el mismo anticonceptivo de por vida No s\u00f3lo no hay ninguna raz\u00f3n m\u00e9dica para hacerlo, sino que la mayor\u00eda de las mujeres acaban cambiando de anticonceptivo con el tiempo debido a los efectos secundarios o a los cambios en el estilo de vida, dice la doctora Sheeva Talebian, asesora de WH y endocrin\u00f3loga reproductiva del CCRM de Nueva York. Y eso est\u00e1 muy bien: encuentra un anticonceptivo que funcione para ti en cualquier etapa de la vida. [Women's Health US](https://www.womenshealthmag.com/health/g28425278/worst-health-advice/) Mario Casas y su 'sensei' fitness para estar tocho Los s\u00edntomas de la nueva variante de la COVID El famoso 'ni\u00f1o culturista' 6 a\u00f1os despu\u00e9s Qu\u00e9 es el pickleball y d\u00f3nde jugarlo en Espa\u00f1a "}