{"title": "El Grupo Libertad Digital ante la crisis medi\u00e1tica", "author": "Federico Jim\u00e9nez Losantos", "url": "https://www.libertaddigital.com/opinion/el-blog-de-federico/el-grupo-libertad-digital-ante-la-crisis-mediatica-9827/", "hostname": "libertaddigital.com", "description": "En el \u00faltimo mes se han producido acontecimientos de enorme gravedad en el \u00e1mbito medi\u00e1tico, y en especial, aunque no exclusivamente, en el \u00e1rea audiovisual.", "sitename": "Libertad Digital", "date": "2011-06-17", "cleaned_text": "El Grupo Libertad Digital ante la crisis medi\u00e1tica En el \u00faltimo mes se han producido acontecimientos de enorme gravedad en el \u00e1mbito medi\u00e1tico, y en especial, aunque no exclusivamente, en el \u00e1rea audiovisual. Leemos continuamente noticias sobre Veo 7, 10, Intereconom\u00eda, la prensa de papel, los gratuitos, la prensa econ\u00f3mica, los suplementos regionales, las pautas publicitarias, las resintonizaciones, las p\u00e9rdidas, los cierres, las fusiones y las subvenciones. Y siendo en apariencia distintas, todas esas noticias tienen mucho en com\u00fan: la crisis brutal de los medios independientes a causa de una situaci\u00f3n econ\u00f3mica terrible que ha llegado devastadoramente a la publicidad y de una actuaci\u00f3n liberticida del Gobierno que, sin queja de la oposici\u00f3n, quiere aprovechar esta crisis econ\u00f3mica y publicitaria para acabar f\u00edsicamente con la ya limitada pluralidad medi\u00e1tica al alcance de la ciudadan\u00eda. Es archievidente la concentraci\u00f3n televisiva en dos gigantescos grupos, el de Berlusconi y el de Lara (en el que se insertar\u00e1 muy probablemente la Sexta de Roures, Barroso y compa\u00f1\u00eda) cada uno de los cuales tiene hasta ocho canales de \u00e1mbito nacional. Los dem\u00e1s canales nacionales est\u00e1n vendidos (Cuatro) en venta o en alquiler, pero a un precio (seis millones de euros, mil millones de pesetas al a\u00f1o) imposible para una empresa honrada que se base en sus propios medios para sobrevivir y que no forme parte de una operaci\u00f3n multimedia o no se resigne a la alternativa que los pol\u00edticos ofrecen: crear dos arcas de No\u00e9 entre todos los ideol\u00f3gicamente cercanos, para garantizar la supervivencia de las empresas y garantizarse el control de los medios magm\u00e1ticos, a cambio, como siempre, de nuevas concesiones que son nuevas zanahorias para soportar el implacable palo. A la oligopolizaci\u00f3n televisiva, que nos ha hecho retroceder veinte a\u00f1os, se a\u00f1ade el cerco a las radios y peri\u00f3dicos nuevos o sueltos, configurando un panorama dantesco. En nuestra Junta de Accionistas, Recarte y yo abordamos con absoluta claridad la crisis econ\u00f3mica que padecen los medios, incluido nuestro grupo aunque sea el m\u00e1s saludable de los afectados, y el marco pol\u00edtico e ideol\u00f3gico en que se produce, que nos afecta como a todos los dem\u00e1s. Esta parte est\u00e1 dando lugar a interpretaciones distintas y hasta contradictorias -l\u00f3gico, porque no estuvieron en la Junta de Accionistas, los discursos fueron largos y muchas las preguntas de los que, debo decirlo, nos brindaron el respaldo m\u00e1s incondicional y emotivo de todos estos a\u00f1os-, as\u00ed que quiero que pueda verse y o\u00edrse lo que realmente dije. A\u00f1adir\u00eda el resumen de La Ma\u00f1ana del jueves a las 8.30 [recogido por Vicky](http://blogs.libertaddigital.com/blog-de-federico/menos-mal-que-se-queja-cospedal-9760/9.html) en este blog as\u00ed [como la transcripci\u00f3n de Paserifo](http://blogs.libertaddigital.com/blog-de-federico/menos-mal-que-se-queja-cospedal-9760/9.html), (comentario 430 y posteriores), dos trabajos que agradezco mucho. Faltan el tono y el gesto, pero como todo estaba grabado, he aqu\u00ed la informaci\u00f3n completa. Para opinar lo que se quiera, pero, eso s\u00ed, con conocimiento de causa. A continuaci\u00f3n, les ofrecemos un resumen de la intervenci\u00f3n de Federico Jim\u00e9nez Losantos ante los accionistas "}