{"title": "Inquietudes Comunes Acerca de las Vacunas", "author": "Alex Fulton", "url": "https://www.healthywomen.org/created-with-support/inquietudes-comunes-acerca-de-las-vacunas", "hostname": "healthywomen.org", "description": "Lo que preocupa a muchas personas acerca de las vacunas - y la informaci\u00f3n que pudiera darles seguridad y confianza", "sitename": "HealthyWomen", "date": "2021-02-23", "cleaned_text": "Inquietudes Comunes Acerca de las Vacunas Lo que preocupa a muchas personas acerca de las vacunas - y la informaci\u00f3n que pudiera darles seguridad y confianza Feb 23, 2021 Aug 17, 2023Created With Support Alex Fulton has been working in the wellness field for more than 20 years. She has written about integrative medicine, herbalism, supplements women's midwives and functional medicine practitioners to promote natural approaches to health care for women. She has a BA in English from the University of Wisconsin-Madison. Learn about our [editorial policies](https://www.healthywomen.org/editorial-policy) Lo que preocupa a muchas personas acerca de las vacunas - y la informaci\u00f3n que pudiera darles seguridad y confianza He escuchado a gente decir que las vacunas causan el autismo. \u00bfEsto le pudiera pasar a mi hijo/a? Las vacunas no causan el autismo. El enlace entre las vacunas y el autismo fue sugerido en 1997 por un cirujano brit\u00e1nico cuyo nombre es Andrew Wakefield pero se determin\u00f3 que sus hallazgos cl\u00ednicos eran falsos y su licencia para ejercer la medicina fue revocada. Desde entonces, muchos estudios han conclu\u00eddo que no existe una conexi\u00f3n entre las vacunas y el autismo. \u00bfEs mejor crear inmunidad despu\u00e9s de padecer la enfermedad o por una vacuna? Si bien es cierto que contraer una infecci\u00f3n puede resultar en una inmunidad m\u00e1s fuerte de lo que uno adquiere con una vacuna, el riesgo de padecer una enfermedad seria supera con creces cualquier peligro que representa la vacunaci\u00f3n. Si usted decide que prefiere experimentar el sarampi\u00f3n para inmunizarse, tendr\u00eda un chance en 50 de fallecer de la enfermedad mientras que el riesgo de tener una reacci\u00f3n severa a la vacuna del sarampi\u00f3n - \u00a1es de una en un mill\u00f3n! \u00bfSab\u00edas que? Vacunas previenen entre 2 y 3 millones de muertes mundialmente cada a\u00f1o. Mi amiga est\u00e1 convencida que la vacuna para prevenir la gripe se la provoc\u00f3. \u00bfPodr\u00eda ser posible? Las vacunas pueden causar efectos secundarios leves como el cansancio, dolor de cabeza o fiebre, y por eso, algunas personas piensan que se enfermaron por la vacuna. Estos efectos secundarios son una se\u00f1al que la vacuna est\u00e1 trabajando - y que el sistema inmunol\u00f3gico est\u00e1 montando una defensa contra la enfermedad. \u00bfSab\u00edas que? Las vacunas contra la gripe pueden bajar a creces la probabilidad de que su hijo/a se muera de la gripe. Ya que las vacunas contra el COVID-19 se desarrollaron con tanta rapidez, me preocupa que no sean seguras. \u00bfSe necesita m\u00e1s tiempo para investigarlas? Las vacunas contra el COVID-19 se han sometido al control de seguridad m\u00e1s intensivo en la historia de los Estados Unidos. Y la base cient\u00edfica usada para su desarrollo no es nueva, ya que este tipo de vacuna se ha estudiado durante m\u00e1s de 30 a\u00f1os. Me parece que el calendario de recomendaciones para las vacunas infantiles requiere muchas inyecciones. \u00bfEsto es peligroso para los ni\u00f1os? El calendario de vacunas infantiles est\u00e1 basado en muchas pruebas que son revisadas continuamente por m\u00e9dicos y expertos de salud p\u00fablica. Los ni\u00f1os reciben estas vacunas a edad tierna porque es cuando ellos est\u00e1n a mayor riesgo de enfermarse o morirse de enfermedades infecciosas. \u00bfSab\u00edas que? Aun si un beb\u00e9 fuese a recibir las 14 vacunas recomendadas de una vez, su sistema inmunol\u00f3gico pudiera f\u00e1cilmente tolerarlas. \u00bfPor qu\u00e9 los gobiernos estatales requieren que mi hijo/a reciba las vacunas antes de matricularse en la escuela? Muchas personas en su comunidad, por ejemplo, los que tienen c\u00e1ncer, diabetes tipo 1, VIH/SIDA y otras condiciones, no pueden vacunarse. Si suficientes personas se vacunan contra una enfermedad, se crea la inmunidad colectiva, o sea la enfermedad no se puede transmitir porque tantas personas son inmunes por la vacunaci\u00f3n o porque han tenido la enfermedad. En comunidades en que existe la inmunidad colectiva, hasta esos individuos que no se pueden vacunar est\u00e1n protegidos de la enfermedad. Cuando decide vacunarse, usted no solo se est\u00e1 protegiendo a s\u00ed mismo, sino tambi\u00e9n est\u00e1 protegiendo a su familia, sus amistades y sus vecinos que no tienen esa opci\u00f3n. Este recurso fue creado con el apoyo de Merck y Pfizer. "}