{"title": "Homeopathy should have professional accreditation revoked, NHS leaders urge", "author": "Gareth Iacobucci", "url": "https://www.bmj.com/content/367/bmj.l6248", "hostname": "bmj.com", "description": "Senior NHS leaders have called for the UK's largest group of registered homeopaths to have its accreditation revoked amid concerns that some practitioners are spreading misinformation about vaccines. In a letter to the Professional Standards Authority (PSA) for Health and Social Care, NHS England chief executive Simon Stevens and national medical director Stephen Powis expressed \"serious concerns\" about the possible reaccreditation of the Society of Homeopaths. Such a seal ...", "sitename": "The BMJ", "date": "2019-10-29", "cleaned_text": "News Homeopathy should have professional accreditation revoked, NHS leaders urgeBMJ 2019; 367 doi: [https://doi.org/10.1136/bmj.l6248](https://doi.org/10.1136/bmj.l6248)(Published Gareth Iacobucci - The BMJ Senior NHS leaders have called for the UK's largest group of registered homeopaths to have its accreditation revoked amid concerns that some practitioners are spreading misinformation about vaccines. In a letter to the Professional Standards Authority (PSA) for Health and Social Care, NHS England chief executive Simon Stevens and national medical director Stephen Powis expressed \"serious concerns\" about the possible reaccreditation of the Society of Homeopaths. Such a seal ... [View Full Text](https://www.bmj.com/content/367/bmj.l6248.full) Log in Log in using your username and password Log in through your institution Subscribe from \u00a3173 * Subscribe and get access to all BMJ articles, and much more. * For online subscription Access this article for 1 day for: \u00a338 / $45 / \u20ac42 ( [excludes VAT](/company/eu-vat-rates/)) You can download a PDF version for your personal record. "}