{"title": "\u00bfCu\u00e1l es la mejor vitamina para aumentar las defensas?", "author": "El Pa\u00eds", "url": "https://www.elpais.com.co/salud/cual-es-la-mejor-vitamina-para-aumentar-las-defensas-0915.html", "hostname": "elpais.com.co", "description": "Las vitaminas son necesarias para el metabolismo del cuerpo humano, con ellas no solo mejora su funci\u00f3n sino que se adquieren m\u00e1s defensas.", "sitename": "El Pa\u00eds", "date": "2023-05-09", "cleaned_text": "Salud \u00bfCu\u00e1l es la mejor vitamina para aumentar las defensas? Las vitaminas son necesarias para el metabolismo del cuerpo humano, con ellas no solo mejora su funci\u00f3n sino que se adquieren m\u00e1s defensas. [9 de mayo de 2023](/tag/fecha/2023-05-09/)Por: El Pa\u00eds Los seres humanos necesitan reforzar todas las vitaminas y minerales que aportan los alimentos que se consumen a diario, ya que est\u00e1n presentes en porciones muy peque\u00f1as, y es muy importante saber que son necesarias para el metabolismo, seg\u00fan lo explica la Organizaci\u00f3n de las Naciones Unidas para la Alimentaci\u00f3n y la Agricultura, FAO (por sus siglas en ingl\u00e9s), por esa raz\u00f3n, se debe reforzar su consumo con m\u00e1s alimentos o apostarle a los suplementos. [Cabe mencionar que incluso cuando disfrutamos de buena salud, factores como el estr\u00e9s y la ansiedad pueden da\u00f1ar en el largo plazo nuestro sistema inmunol\u00f3gico. Por lo que tambi\u00e9n nos volvemos m\u00e1s susceptibles de enfermar con cierta facilidad. ](https://www.elpais.com.co/salud/cuanto-tardan-los-pulmones-en-limpiarse-de-nicotina-0908.html) Para fortalecerlo hay que comenzar por un estilo de vida saludable, con una dieta rica en frutas, verduras y legumbres, una pr\u00e1ctica de ejercicio con regularidad y sin vicios nocivos como pueden ser el tabaco o el alcohol. Pero adem\u00e1s de estos consejos, cada cierto tiempo es interesante apostar por los suplementos de vitaminas y minerales, ya que, sin saberlo, alguno puede escasear en nuestra alimentaci\u00f3n. Y en \u00e9pocas como los cambios de clim\u00e1ticos son una forma excelente de prevenir los habituales resfriados. Son 13 vitaminas esenciales que el cuerpo necesita para funcionar de manera correcta: vitamina A, vitamina C, vitamina D, vitamina E, vitamina K, vitamina B1, vitamina B2, vitamina B3, vitamina B6, vitamina B12, folato, \u00e1cido patot\u00e9nico y biotina. A continuaci\u00f3n, un recuento de las vitaminas m\u00e1s importes y los alimentos en donde se pueden encontrar: Vitamina A La falta de esta vitamina en el cuerpo tiene la caracter\u00edstica de afectar a partes espec\u00edficas del sistema inmune. La vitamina A es muy importante para el sistema inmunol\u00f3gico ya que estimula la producci\u00f3n de linfocitos (un tipo de c\u00e9lulas blancas sangu\u00edneas) y su actividad. Los linfocitos atacan a los agentes invasores y ayudan al cuerpo a producir las prote\u00ednas llamadas anticuerpos, que mantendr\u00e1n a raya infecciones futuras. Se pueden encontrar f\u00e1cilmente en los l\u00e1cteos, el br\u00e9col, los huevos y la col rizada, o kale. Vitamina C Para empezar, lo mejor es combatir g\u00e9rmenes e infecciones, que son los revestimientos de la nariz, el intestino y los pulmones, en los que el col\u00e1geno tiene un importante papel. Para esto, la vitamina C es fundamental a la hora de sintetizar el col\u00e1geno, sin ella el cuerpo no es capaz de elaborarlo y, por tanto, dichos revestimientos lo necesitan para mantenerse en forma. Tambi\u00e9n ayuda al sistema inmune a reaccionar ante virus e infecciones, incrementando la producci\u00f3n de c\u00e9lulas blancas, enzimas y anticuerpos. Tiene igualmente efectos antiinflamatorios y antioxidantes, elementos clave para limitar el perjuicio causado por los radicales liberados durante una respuesta inmune. Las mejores fuentes son: los c\u00edtricos, los kiwis, las frutas del bosque, los pimientos, el repollo, los tomates y las espinacas. Vitamina B Las vitaminas de este grupo ayudan a las c\u00e9lulas del cuerpo a generar la energ\u00eda que aportan los alimentos y a usar los nutrientes para reparar los tejidos. Por ejemplo, la vitamina B6 (piridoxina), es vital para el desarrollo cerebral y para mantener en buen estado el sistema nervioso y el sistema inmunitario. Se puede encontrar en el pollo, el pescado como el salm\u00f3n y el at\u00fan, en vegetales verdes y en los garbanzos. [Esta vitamina tambi\u00e9n se puede tomar como suplemento, por lo general, en forma de c\u00e1psula, comprimido o l\u00edquido; sin embargo, se recomienda que se consuma solo si un m\u00e9dico lo receta.](https://www.elpais.com.co/salud/estas-son-las-bondades-y-los-poderosos-usos-medicinales-de-la-hierbabuena-0834.html) Contrario a lo anterior, existen alimentos que debilitan el sistema inmunitario si son ingeridos en exceso, como la sal, el az\u00facar y las grasas saturadas y trans (mantequilla, aceite de palma y coco, queso, entre otros). "}