{"title": "La OMS autoriza el uso de emergencia de la vacuna china Sinopharm contra el coronavirus", "author": "Agencias", "url": "https://www.elconfidencial.com/tecnologia/ciencia/2021-05-07/la-oms-autoriza-el-uso-de-emergencia-de-la-vacuna-china-contra-el-coronavirus_3070207/", "hostname": "elconfidencial.com", "description": "El director del organismo, Tedros Adhanom Ghebreyesus, asegura que esta inyecci\u00f3n, la sexta aprobada, es \"segura y eficaz\"", "sitename": "El Confidencial", "date": "2021-05-07", "cleaned_text": "La OMS autoriza el uso de emergencia de la vacuna china Sinopharm contra el coronavirus El director del organismo, Tedros Adhanom Ghebreyesus, asegura que esta inyecci\u00f3n, la sexta aprobada, es \"segura y eficaz\" La [Organizaci\u00f3n Mundial de la Salud](https://www.elconfidencial.com/tags/organismos/oms-3845/) (OMS) ha autorizado incluir la vacuna contra el coronavirus desarrollada por la farmac\u00e9utica china Sinopharm en su lista de uso de emergencia, convirti\u00e9ndose as\u00ed en la sexta en recibir la validaci\u00f3n. Esto significa que cuenta con el visto bueno del organismo para su distribuci\u00f3n a escala internacional, a la espera de que lo decidan las [agencias regulatorias](https://www.elconfidencial.com/tags/organismos/agencia-europea-de-medicamentos-6539/) de los pa\u00edses. Adem\u00e1s, continuar\u00e1n los procesos de evaluaci\u00f3n continua a lo largo de las pr\u00f3ximas semanas. As\u00ed lo ha anunciado este viernes el director general de la OMS, Tedros Adhanom Ghebreyesus, en una rueda de prensa, donde ha asegurado que esta vacuna es \"segura y eficaz\" y que, por ello, el organismo la ha incluido en su lista de emergencia. La decisi\u00f3n ha llegado despu\u00e9s de que el grupo de expertos en inmunizaci\u00f3n que asesora al organismo revisase la informaci\u00f3n cient\u00edfica aportada por el productor chino. [China anuncia por primera vez la eficacia de una de sus vacunas: un 79% para Sinopharm](https://www.elconfidencial.com/mundo/2020-12-30/china-anuncia-por-primera-vez-la-eficacia-de-una-de-sus-vacunas-un-79-para-sinopharm_2890392/) La lista de vacunas de emergencia de la OMS sirve para evaluar la calidad, seguridad y eficacia de las [vacunas contra el covid-19](https://www.elconfidencial.com/espana/2021-05-07/coronavirus-covid19-datos-vacunacion-muertes_3067567/) y, a su vez, permite a los pa\u00edses acelerar su propia aprobaci\u00f3n regulatoria para importar y administrar las vacunas. Estas tienen que estar incluidas en el listado para poder ser administradas a trav\u00e9s del [mecanismo internacional Covax](https://www.elconfidencial.com/mundo/2021-02-24/el-programa-covax-de-la-oms-arranca-con-el-envio-de-600-000-vacunas-a-ghana_2965979/), con el que la Organizaci\u00f3n Mundial de la Salud busca garantizar que todas las naciones tengan acceso a las dosis. Hasta ahora, la OMS hab\u00eda aprobado el uso de emergencia de las vacunas de Pfizer, AstraZeneca, Janssen y Moderna, adem\u00e1s de la del Serum Institute of India. Los argumentos de la OMS La subdirectora general de Acceso a Productos Sanitarios de la organizaci\u00f3n, Mari\u00e2ngela Sim\u00e3o, ha explicado en la rueda de prensa los beneficios de esta decisi\u00f3n: \"La adici\u00f3n de esta vacuna tiene el potencial de acelerar r\u00e1pidamente el acceso para los pa\u00edses que buscan proteger a los trabajadores de la salud y las poblaciones en riesgo. Instamos al fabricante a participar en Covax y contribuir al objetivo de una distribuci\u00f3n de vacunas m\u00e1s equitativa\". [El programa Covax de la OMS arranca con el env\u00edo de 600.000 vacunas a Ghana](https://www.elconfidencial.com/mundo/2021-02-24/el-programa-covax-de-la-oms-arranca-con-el-envio-de-600-000-vacunas-a-ghana_2965979/) En el caso de Sinopharm, la evaluaci\u00f3n de la OMS ha incluido inspecciones 'in situ' de la instalaci\u00f3n de producci\u00f3n. Se trata de una vacuna inactivada y cuyos [\"f\u00e1ciles requisitos\" de almacenamiento](https://www.elconfidencial.com/mundo/2021-01-30/china-diplomacia-guerra-vacunas_2928931/) la hacen \"muy adecuada\" para entornos de bajos recursos. Tambi\u00e9n es la primera inyecci\u00f3n que llevar\u00e1 un monitor de frascos de vacunas, que es una peque\u00f1a pegatina que cambia de color a medida que el preparado se expone al calor, lo que permite a los trabajadores de salud saber si se puede usar de manera segura. La OMS recomienda la vacuna para adultos mayores de 18 a\u00f1os, en un esquema de dos dosis con un intervalo de tres a cuatro semanas. La eficacia de la vacuna para la enfermedad sintom\u00e1tica y hospitalizada se estim\u00f3 en el 79 por ciento. Finalmente, la OMS desaconseja un l\u00edmite superior de edad para la vacuna porque los datos preliminares sugieren que es probable que tenga un efecto protector en las personas mayores. \"No hay ninguna raz\u00f3n te\u00f3rica para creer que la vacuna tiene un perfil de seguridad diferente en poblaciones mayores y m\u00e1s j\u00f3venes. Por lo tanto, recomendamos que los pa\u00edses que utilizan la vacuna en grupos de mayor edad [realicen un seguimiento de la seguridad](https://www.elconfidencial.com/mundo/europa/2021-04-29/la-ema-registra-casos-de-trombos-con-pfizer-y-moderna-pero_3055936/) y la eficacia para que la recomendaci\u00f3n sea m\u00e1s s\u00f3lida\", ha zanjado el organismo. La [Organizaci\u00f3n Mundial de la Salud](https://www.elconfidencial.com/tags/organismos/oms-3845/) (OMS) ha autorizado incluir la vacuna contra el coronavirus desarrollada por la farmac\u00e9utica china Sinopharm en su lista de uso de emergencia, convirti\u00e9ndose as\u00ed en la sexta en recibir "}