{"title": "Toxicidad pulmonar en perros", "author": "Rodrigo Fr\u00e1vega P\u00e9rez", "url": "https://www.engormix.com/mascotas/toxicidad-pulmonar-perros/", "hostname": "engormix.com", "description": "Bienvenido a la p\u00e1gina de Engormix sobre Toxicidad pulmonar en perros. Videos, art\u00edculos t\u00e9cnicos, foros y noticias sobre Toxicidad pulmonar en perros.", "sitename": "Engormix", "date": "2023-01-01", "cleaned_text": "Publicar Iniciar sesi\u00f3n Explorar Comunidades en espa\u00f1ol Agricultura Balanceados - Piensos Avicultura Ganader\u00eda Lecher\u00eda Micotoxinas de corte Pecu\u00e1ria de leite Anunciar en Engormix Inicio Publicar Buscar Engormix.com / Mascotas / Toxicidad pulmonar en perros # Toxicidad pulmonar en perros Bienvenido a la p\u00e1gina de Engormix sobre Toxicidad pulmonar en perros. Videos, art\u00edculos t\u00e9cnicos, foros y noticias sobre Toxicidad pulmonar en perros. Rodrigo Fr\u00e1vega P\u00e9rez Revisi\u00f3n: Toxicidad pulmonar por ox\u00edgeno. Resumen El suplemento de ox\u00edgeno es un m\u00e9todo simple que consiste b\u00e1sicamente en aumentar la fracci\u00f3n inspirada de ox\u00edgeno (FiO2) con el objetivo de incrementar la presi\u00f3n parcial de ox\u00edgeno arterial y saturaci\u00f3n de la hemoglobina,... # Problemas pulmonares en Mascotas # Toxicidad pulmonar en perros Comentarios: 0 Recomendaciones: 0 Eventos recomendados VICTAM Latam 2023 3 de octubre de 2023 Brasil - Sao Paulo - S\u00e3o Paulo Ver m\u00e1s eventos recomendados 1 S\u00famate a Engormix y forma parte de la red social agropecuaria m\u00e1s grande del mundo. Iniciar "}