{"title": "Apertura del Centro de Medicina Integrativa MARZO 2012", "author": "Publicado por An\u00f3nimo", "url": "http://mindfulnessargentina.blogspot.com/2012/03/apertura-del-centro-de-medicina.html", "hostname": "blogspot.com", "description": "A partir de este mes hemos abierto en la sede de Nu\u00f1ez un Centro de Medicina Integrativa que comparte con la Asociaci\u00f3n Civil Visi\u00f3n Clara ...", "sitename": "mindfulnessargentina.blogspot.com", "date": "2012-03-01", "cleaned_text": "A partir de este mes hemos abierto en la sede de Nu\u00f1ez un Centro de Medicina Integrativa que comparte con la Asociaci\u00f3n Civil Visi\u00f3n Clara una mirada integral del ser humano: \"La Medicina Integrativa se enfoca a conseguir el m\u00e1ximo bienestar de las personas, promover h\u00e1bitos saludables tanto en aspectos relacionados, con el cuerpo, la mente las emociones, realidad de seres sociales y espirituales, as\u00ed como utilizando una aproximaci\u00f3n que refuerza el contacto y cuidado Humanizado y Compasivo. Utiliza para su pr\u00e1ctica, profesionales e id\u00f3neos tanto de lo que describimos como medicina convencional como de medicinas complementarias integrativas (MCI) Estas \u00faltimas est\u00e1n sustentadas en publicaciones m\u00e9dicas que demuestran seguridad y eficacia terap\u00e9utica y que siempre se usan complementariamente al tratamiento \u00f3ptimo cl\u00e1sico, en literatura m\u00e9dica de alta calidad Las MCI deben utilizarse siempre en combinaci\u00f3n y nunca como un reemplazo de un tratamiento convencional y se promueve expl\u00edcitamente el trabajo en equipo interdisciplinario a este fin, mejorando as\u00ed la disgregaci\u00f3n de nuestro sistema medico actual.\" Los consultorios de este centro ser\u00e1n atendidos por los siguientes profesionales de cada \u00e1rea Director General del CMI Dr.M\u00e1ximo de la Vega Medicina Integrativa ( Acupuntura/Psicolog\u00eda Positiva/T\u00e9cnicas Mente Cuerpo) Dr Pablo Mountford Consultorio Mi\u00e9rcoles desde las 14hs Viernes desde las 13hs Oncolog\u00eda Cl\u00ednica y Oncolog\u00eda Integrativa Dr M\u00e1ximo de la Vega Consultorio Jueves desde las 14hs Masaje M\u00e9dico Oncol\u00f3gico Reflexolog\u00eda, Digitopuntura Mariana Garc\u00eda Mata de Mountford Consultorio Viernes de 9 a 12hs Alimentaci\u00f3n y Prevenci\u00f3n Dr Juan Martin Romano Consultorio Martes de 8 a 12hs Psicolog\u00eda Sistemica Especialidad Familia Lic Silvia Iacona Consultorio Primer y \u00faltimo lunes del mes de 8 a 12hs Salud Mental Lic Martin Reynoso Consultorio Lunes desde las 14hs/ Mi\u00e9rcoles y Jueves desde las 9hs CENTRO DE MEDICINA INTEGRATIVA Ciudad de la Paz 3727 2\u00ba piso NU\u00d1EZ PARA SOLICITAR TURNOS comunicarse por mail a cecsoler@gmail.com o telef\u00f3nicamente al 4701-5297 Su consulta se responde en el d\u00eda [Apertura del Centro de Medicina Integrativa MARZO 2012](http://mindfulnessargentina.blogspot.com/2012/03/apertura-del-centro-de-medicina.html) Publicado por An\u00f3nimo on s\u00e1bado, 10 de "}