{"title": "Aromatherapy Market 2023: Outlook, Size, Share, Trends, Growth, Analysis, and Report 2028", "author": "IMARC", "url": "https://www.benzinga.com/pressreleases/23/08/34083665/aromatherapy-market-2023-outlook-size-share-trends-growth-analysis-and-report-2028", "hostname": "benzinga.com", "description": "According to the latest report by IMARC Group, titled \"Aromatherapy Market: Global Industry Trends, Share, Size, Growth, Opportunity and Forecast 2023-2028\", offers a comprehensive analysis of the industry, which", "sitename": "Benzinga", "date": "2023-08-29", "cleaned_text": "According to the latest report by IMARC Group, titled \"Aromatherapy Market: Global Industry Trends, Share, Size, Growth, Opportunity and Forecast 2023-2028\", offers a comprehensive analysis of the industry, which comprises insights on the global [aromatherapy market](https://www.imarcgroup.com/aromatherapy-market). The report also includes competitor and regional analysis, and contemporary advancements in the market. The global aromatherapy market is expected to exhibit a growth rate (CAGR) of 10.3% during 2023-2028. Aromatherapy Market Overview: Aromatherapy is a healing practice that uses aromatic essential oils extracted from plants to promote physical, emotional, and psychological well-being. These oils are often inhaled or applied to the skin, and their natural scents are believed to have therapeutic effects on the body and mind. Aromatherapy alleviates stress, anxiety, and pain, enhances relaxation, improves sleep quality, and boosts mood. The practice has ancient origins and is now integrated into modern wellness routines, spa treatments, and complementary medicine. Get a Sample Copy of the Report at: [https://www.imarcgroup.com/aromatherapy-market/requestsample](https://www.imarcgroup.com/aromatherapy-market/requestsample) Global Aromatherapy Market Trends: The global market is majorly driven by the increasing focus on holistic well-being and self-care. In line with this, the rising popularity of aromatherapy as a natural healing method is significantly contributing to the market. Furthermore, aromatherapys potential to reduce stress and anxiety and promote relaxation aligns with modern lifestyles, seeking stress management solutions positively influencing the market. The rising interest in alternative and complementary therapies boosts the demand for aromatherapy as a non-invasive healing option. Moreover, aromatherapy is integral to spa treatments, and the booming spa industry contributes to the markets expansion. Besides, the online availability of essential oils and related products facilitates easy access, expanding the consumer base globally. Additionally, the consumer preference for natural and organic products extends to aromatherapy, driving market growth. Competitive Landscape with Key Players: - Air Aroma - d-TERRA - Eden Gardens - Frontier Co-op. - Hubmar International Inc - Isagenix Worldwide Inc. - Mountain Rose Herbs - Nu Skin Enterprises Inc - Plant Therapy Essential Oils - Rocky Mountain Oils LLC - Stadler Form Aktiengesellschaft - Young Living Essential Oils Explore the Full Report with Charts, Table of Contents, and List of Figures: [https://www.imarcgroup.com/aromatherapy-market](https://www.imarcgroup.com/aromatherapy-market) Breakup by Product: - Consumables - Essential Oils - Carrier Oils - Equipment - Ultrasonic Diffuser - Nebulizing Diffuser - Evaporative Diffuser - Heat Diffuser Breakup by Mode of Delivery: - Topical Application - Direct Inhalation - Aerial Diffusion Breakup by Application: - Relaxation - Skin and Hair Care - Pain Management - Insomnia - Scar Management - Others Breakup by End-Use: - Hospitals and Clinics - Home Use - Spa and Wellness Centers - Yoga and Meditation Centers - Others Breakup by Distribution Channel: - DTC (Direct-to-Consumer) - B2B Breakup by Region: - North America (United States, Canada) - Europe (Germany, France, United Kingdom, Italy, Spain, Others) - Asia Pacific (China, Japan, India, Australia, Indonesia, Korea, Others) - Latin America (Brazil, Mexico, Others) - Middle East and Africa (United Arab Emirates, Saudi Arabia, Qatar, Iraq, Other) Key Highlights of the Report: - Market Performance - Market Outlook - Porter's Five Forces Analysis - Market Drivers and Success Factors - SWOT Analysis - Value Chain - Comprehensive Mapping of the Competitive Landscape About Us: IMARC Group is a leading market research company that offers management strategy and market research worldwide. We partner with clients in all sectors and regions to identify their highest-value opportunities, address their most critical challenges, and transform their businesses. IMARC's information products include major market, scientific, economic and technological developments for business leaders in pharmaceutical, industrial, and high technology organizations. Market forecasts and industry analysis for biotechnology, advanced materials, pharmaceuticals, food and beverage, travel and tourism, nanotechnology and novel processing methods are at the top of the company's expertise. Contact Us: IMARC Group 134 N 4th St. Brooklyn, NY 11249, [Sales@imarcgroup.com](mailto:Sales@imarcgroup.com) Tel and | Asia: +91-120-433-0800, +91-120-433-0800 The post [Aromatherapy Market 2023: Outlook, Size, Share, Trends, Growth, Analysis, and Report 2028](https://www.supermarketresearch.com/2023/08/29/aromatherapy-market-2023-outlook-size-share-trends-growth-analysis-and-report-2028/) appeared first on [Super Market Research](https://www.supermarketresearch.com). COMTEX_439188269/2607/2023-08-29T05:23:28 \u00a9 2023 Benzinga.com. Benzinga does not provide investment advice. All rights reserved. "}