{"title": "AstraZeneca podr\u00eda despejar dudas sobre su vacuna con un estudio adicional", "author": "Marian Martinez", "url": "https://www.elciudadano.com/actualidad/astrazeneca-podria-despejar-dudas-sobre-su-vacuna-con-un-estudio-adicional/11/26/", "hostname": "elciudadano.com", "description": "La biofarmac\u00e9utica brit\u00e1nica AstraZeneca har\u00e1 todo lo posible por despejar las dudas que rodean la efectividad de su vacuna contra el COVID-19 y, para", "sitename": "El Ciudadano, Noticias de Chile y Latinoam\u00e9rica para el Mundo", "date": "2020-11-26", "cleaned_text": "En medio de las preocupaciones de la comunidad cient\u00edfica AstraZeneca podr\u00eda despejar dudas sobre su vacuna con un estudio adicional Por [Marian Martinez](https://www.elciudadano.com/author/marianmartinez/) [Actualidad](https://www.elciudadano.com/actualidad/) / [Mundo](https://www.elciudadano.com/mundo/) / [Salud](https://www.elciudadano.com/salud/) 0 0 La biofarmac\u00e9utica brit\u00e1nica AstraZeneca har\u00e1 todo lo posible por despejar las dudas que rodean la efectividad de su vacuna contra el COVID-19 y, para ello, es probable que lleve a cabo una prueba global adicional. As\u00ed lo inform\u00f3 Bloomberg, citando al director ejecutivo de la compa\u00f1\u00eda, Pascal Soriot. Esta noticia se produce en medio de las preocupaciones de la comunidad cient\u00edfica y los reguladores gubernamentales, las cuales surgieron tras la publicaci\u00f3n de los resultados de sus ensayos por parte de la empresa. La pol\u00e9mica surgi\u00f3 despu\u00e9s de que AstraZeneca inform\u00f3 el lunes 23 de que obtuvo una eficacia del 62 % en pruebas con un grupo de voluntarios que recibi\u00f3 dos dosis completas de la vacuna experimental, con un intervalo de un mes. Pero el resultado creci\u00f3 al 90 % en ensayos con un segundo grupo de participantes, menos numeroso, que recibi\u00f3 media dosis inicialmente, seguida despu\u00e9s de una dosis entera. De acuerdo con el reporte de la agencia Sputnik, ese mismo d\u00eda, en entrevistas con los medios de comunicaci\u00f3n, el director ejecutivo de AstraZeneca aclar\u00f3 que el r\u00e9gimen de media dosis fue el resultado de un error de fabricaci\u00f3n, que ni la compa\u00f1\u00eda ni Oxford mencionaron inicialmente en sus comunicados de prensa anunciando los resultados. \u00abAhora que hemos encontrado lo que parece una mejor eficacia, tenemos que validar esto, por lo que necesitamos hacer un estudio adicional\u00bb, asever\u00f3. En sus declaraciones a Bloomberg, [aclar\u00f3](https://www.bloomberg.com/news/articles/2020-11-26/astra-likely-to-run-fresh-global-covid-vaccine-trial-ceo-says?srnd=premium-europe) que probablemente ser\u00e1 otro \u00abestudio internacional, pero este podr\u00eda ser m\u00e1s r\u00e1pido porque sabemos que la eficacia es alta, por lo que necesitamos un n\u00famero menor de pacientes\u00bb. As\u00ed, la nueva prueba se llevar\u00eda a cabo en lugar de agregar una secci\u00f3n a un ensayo en curso en EE. UU. y evaluar\u00eda una dosis m\u00e1s baja que funcion\u00f3 mejor que la cantidad total en los estudios de AstraZeneca. \u00abError irrelevante\u00bb En medio de la confusi\u00f3n, AstraZeneca perdi\u00f3 casi un 6 % de su valor en la Bolsa de Londres, mientras un sector defiende los ensayos desarrollados por la farmac\u00e9utica. Mene Pangalos, vicepresidente ejecutivo de investigaci\u00f3n de AstraZeneca, desestim\u00f3 las afirmaciones de que su vacuna contra el coronavirus se basa en una \u00abciencia inestable\u00bb y afirm\u00f3 que \u00abel error es realmente irrelevante\u00bb, rese\u00f1\u00f3 la cadena RT. \u00abIndependientemente de la forma en que corte los datos [...] todav\u00eda tenemos una eficacia que cumple con los umbrales para la aprobaci\u00f3n con una vacuna que tiene m\u00e1s del 60 por ciento de eficacia\u00bb, subray\u00f3 Pangalos. La Organizaci\u00f3n Mundial de la Salud (OMS) estableci\u00f3 un objetivo de 50 % de eficacia para las vacunas contra el COVID-19. Fuentes: RT, Agencia Sputnik. Hazte socio Con tu donaci\u00f3n aportas a la sostenibilidad econ\u00f3mica y existencia de este medio. Elige c\u00f3mo quieres aportar a la existencia y financiamiento colectivo de "}