{"title": "Alerts", "author": null, "url": "https://www.uscis.gov/news/alerts", "hostname": "uscis.gov", "description": "Timely updates, searchable by topic and date. For material older than three years or that is no longer current, see our", "sitename": "USCIS", "date": "2021-10-28", "cleaned_text": "Alerts Timely updates, searchable by topic and date. For material older than three years or that is no longer current, see our [Archive section](/archive?topic_id=16955&r_date_m%5Bvalue%5D%5Bmonth%5D=&r_date_y%5Bvalue%5D%5Byear%5D=&combine=&items_per_page=10). Subscribe to get notifications of new alerts: [Directions for Class Members Filing Motions to Reopen Pursuant to Settlement Agreement in H-1B Market Research Analyst Class Action Litigation](/newsroom/alerts/directions-for-class-members-filing-motions-to-reopen-pursuant-to-settlement-agreement-in-h-1b) USCIS reached a settlement agreement [PDF] in the case of MadKudu Inc., et al. v. U.S. Citizenship and Immigration Services, et al., No. 20-cv-2653 (N.D. Cal.). On Oct. 19, 2021, the U.S. District Court, Northern District of California, San Jose Division, granted final approval of the settlement agreement. This agreement outlines new, overarching guidance for adjudicating pending or future H-1B petitions for market research analysts. As part of our credit card payment pilot program, the Vermont Service Center is now accepting credit card payments using [Form G-1450, Authorization for Credit Card Transactions](https://www.uscis.gov/g-1450), for petitioners filing [Form I-129, Petition for a Nonimmigrant Worker](https://www.uscis.gov/i-129), for O and P nonimmigrants. At the end of the pilot, we will evaluate the results and determine the next steps for expanding this payment option for other forms or other service centers. The goal of this pilot is to bring USCIS one step closer to accepting digital payments using a credit card at all service centers. We [started](https://www.uscis.gov/news/alerts/uscis-announces-pilot-program-for-credit-card-payments-using-form-g-1450-when-filing-form-i-485), and then [expanded](https://www.uscis.gov/news/alerts/uscis-expands-credit-card-payment-pilot-program-to-form-i-140-when-requesting-premium-processing), this program at the Nebraska Service Center, and then further expanded the program to the [Texas Service Center](https://www.uscis.gov/newsroom/alerts/uscis-expands-credit-card-payment-pilot-program-to-texas-service-center). For more information, please see our [Direct Filing Addresses for Form I-129](https://www.uscis.gov/i-129-addresses)page. U.S. Citizenship and Immigration Services is issuing updated and comprehensive guidance in the USCIS Policy Manual on adjudicating applications for T nonimmigrant status (or T visas) submitted by victims of human trafficking, including clarifying how applicants establish eligibility. U.S. Citizenship and Immigration Services has received enough petitions to reach the congressionally mandated cap on H-2B visas for temporary nonagricultural workers for the first half of fiscal year 2022. USCIS reminds employers of Commonwealth of the Northern Mariana Islands (CNMI) Transitional Workers (CW-1) that, if you have a currently-approved CW-1 petition with a validity period of six months or more, you must file Form I-129CWR, Semiannual Report for CW-1 Employers, with USCIS every six months after the petition validity start date. In response to the coronavirus (COVID-19) pandemic, U.S. Citizenship and Immigration Services is extending the flexibilities it announced on March 30, 2020. As part of our credit card payment pilot program, the Texas Service Center is now accepting credit card payments using Form G-1450, Authorization for Credit Card Transactions, for petitioners filing Form I-140, Immigrant Petition for Alien Workers, with Form I-907, Request for Premium Processing Service, or when filing Form I-907 to upgrade a pending Form I-140 to premium processing. U.S. Citizenship and Immigration Services today announced that, effective Oct. 1, 2021, applicants subject to the immigration medical examination must be fully vaccinated against COVID-19 before the civil surgeon can complete an immigration medical examination and sign Form I-693, Report of Medical Examination and Vaccination Record. [USCIS Extends Evidence of Status for Conditional Permanent Residents to 24 Months with Pending Form I-751 or Form I-829](/newsroom/alerts/uscis-extends-evidence-of-status-for-conditional-permanent-residents-to-24-months-with-pending-form) Starting Sept. 4, 2021, USCIS is extending the time that receipt notices can be used to show evidence of status from 18 months to 24 months for petitioners who properly file Form I-751, Petition to Remove Conditions on Residence, or Form I-829, Petition by Investor to Remove Conditions on Permanent Resident Status. We have created a new Lockbox Filing Location Updates page on our website for customers to keep track of updates we make to lockbox "}