{"title": "Dieta depurativa", "author": "Editorial", "url": "https://www.botanical-online.com/dietas/depurativa-dieta-alimentos-buenos", "hostname": "botanical-online.com", "description": "Las dietas depurativas pueden constituir una alternativa m\u00e1s f\u00e1cil de llevar que los ayunos estrictos o un paso previo de iniciaci\u00f3n al ayuno", "sitename": "Botanical-online", "date": "2019-01-19", "cleaned_text": "Contenidos [1 BENEFICIOS DE LA DIETA DEPURATIVA](#BENEFICIOS_DE_LA_DIETA_DEPURATIVA) [2 DIETA DE LA FRUTA COMO ALIMENTO EXCLUSIVO](#DIETA_DE_LA_FRUTA_COMO_ALIMENTO_EXCLUSIVO) BENEFICIOS DE LA DIETA DEPURATIVA | | Los jugos de frutas son ricos en vitaminas y antioxidantes que ayudar\u00e1n al organismo a recuperar su salud y energ\u00eda. \u00bfQu\u00e9 es una dieta depurativa? Las DIETAS DEPURATIVAS tienen la funci\u00f3n limpiar el organismo y establecer un equilibrio corporal. Las dietas depurativas pueden constituir una alternativa m\u00e1s f\u00e1cil de llevar que los ayunos estrictos o un paso previo de iniciaci\u00f3n al ayuno, que nos permitir\u00e1 en otro momento acceder m\u00e1s f\u00e1cilmente al ayuno total. Existen muchas dietas depurativas, pero entre todas ellas merece la pena mencionar las dietas de verduras y frutas. Entre todas ellas destacan las siguientes: - Dieta de la fruta: [Dieta realizada exclusivamente con fruta](#dietafruta): Se trata de una dieta m\u00e1s estricta en la que la un tipo de fruta aparece como \u00fanico alimento. - Dieta de las verduras: [Dieta mixta de frutas y verduras](https://www.botanical-online.com/dietas/mixta-frutas-verduras-dieta-alimentos-buenos): En la que se combina la fruta con otras verduras. DIETA DE LA FRUTA COMO ALIMENTO EXCLUSIVO Ventajas de la dieta de frutas La dieta de la fruta es un tipo de cura natural consistente en comer solamente fruta durante algunos d\u00edas. Este tipo de dietas se utiliza fundamentalmente en primavera, aunque puede llevarse a cabo en cualquier \u00e9poca del a\u00f1o. Hay que hacer constar que es diferente esta dieta del hecho de comer fruta en alguna comida del d\u00eda, como puede ser el desayuno, merienda o la cena. Se trata de comer solamente fruta durante algunos d\u00edas. La fruta tiene la ventaja de que contiene mucha [agua](https://www.botanical-online.com/dietas/funciones-agua-organismo), muchas vitaminas, minerales y [flavonoides](https://www.botanical-online.com/plantas-medicinales/flavonoides-propiedades-caracteristicas). La cantidad de agua y potasio de las frutas realiza [propiedades diur\u00e9ticas](https://www.botanical-online.com/plantas-medicinales/plantas-medicinales-diureticas), por lo que aumenta la micci\u00f3n y con ella arrastra las toxinas de nuestro organismo. La mayor\u00eda de \u00f3rganos digestivos ( [h\u00edgado](https://www.botanical-online.com/plantas-medicinales/higado-plantas-medicinales), ri\u00f1ones, ves\u00edcula biliar, p\u00e1ncreas, [intestinos](https://www.botanical-online.com/plantas-medicinales/intestino-remedios-plantas), etc) resultan fortalecidos y purificados con estas curas. La fruta es muy rica en [fibra](https://www.botanical-online.com/dietas/fibra-caracteristicas-ventajas) por lo que, al evitar el [estre\u00f1imiento](https://www.botanical-online.com/dietas/estrenimiento-tratamiento), conseguir\u00e1 eliminar del intestino todas las impurezas. \u00bfC\u00f3mo realizar una cura de frutas? A la hora de realizar una dieta de frutas tenemos que tener en cuenta la siguientes consideraciones: - Tipo de fruta: Se debe escoger fruta fresca, de buena calidad, preferentemente de [cultivos biol\u00f3gicos](https://www.botanical-online.com/dietas/alimentos-naturales-beneficios). En este caso, bastar\u00e1 solo con lavarla y se comer\u00e1 con la piel dado que la mayor\u00eda de las vitaminas y minerales se encuentran en ella. Es importante escoger la fruta correspondiente a la estaci\u00f3n del momento y rechazar aquella fruta que ha estado mucho tiempo en la c\u00e1maras frigor\u00edficas. Una de las frutas m\u00e1s diur\u00e9ticas es la pera, debido a la arbutina, un componente que se encuentra en su piel. - Como comer la fruta: Se comer\u00e1 la fruta cruda cruda. Aunque la fruta cocida puede resultar muy sabrosa, pierde muchas propiedades en la cocci\u00f3n. - Evitar la fruta contaminada: Si no estamos seguros que la fruta procede de cultivos biol\u00f3gicos es mejor pelarla. Nunca se debe comer la piel de los c\u00edtricos dado que reciben muchos tratamientos fitosanitarios. - Cantidad de fruta recomendada: La cantidad de fruta diaria se establece entre 1 y 2,5 kilos diarios como m\u00e1ximo. - Duraci\u00f3n de la dieta: La duraci\u00f3n habitual de este tipo de curas de frutas es de unos 2- 3 d\u00edas aunque, en condiciones de mucho control m\u00e9dico, puede alargarse hasta 12 d\u00edas. - \u00bfQu\u00e9 puede tomarse?: A parte de las frutas, se debe beber agua en abundancia y, a\u00fan mejor, pueden tomarse tisanas depurativas o diur\u00e9ticas con plantas que estimulen la funci\u00f3n renal y ayuden a eliminar l\u00edquidos, por ejemplo el [diente de le\u00f3n](https://www.botanical-online.com/plantas-medicinales/diente-leon-taraxacum-propiedades), la [ortiga](https://www.botanical-online.com/plantas-medicinales/ortiga-urtica-dioica-propiedades-caracteristicas), la [cola de caballo](https://www.botanical-online.com/plantas-medicinales/equiseto-cola-caballo-propiedades-caracteristicas), etc. (M\u00e1s informaci\u00f3n sobre [plantas diur\u00e9ticas](https://www.botanical-online.com/plantas-medicinales/plantas-medicinales-diureticas)) Para acompa\u00f1ar a las frutas pueden tambi\u00e9n tomarse zumos que har\u00e1n m\u00e1s f\u00e1cil la ingesti\u00f3n de estos alimentos. Adem\u00e1s de utilizar tisanas o zumos, resulta muy conveniente utilizar el jugo fresco de las hojas de algunas de estas plantas diur\u00e9ticas, como los berros, el [llant\u00e9n](https://www.botanical-online.com/plantas-medicinales/llanten-propiedades) o el diente de le\u00f3n o repartir el zumo de un par de limones exprimidos diluido en agua a lo largo de todo el d\u00eda. - \u00bfQu\u00e9 no se debe comer?: Ciertos productos t\u00f3xicos o excitantes como el [caf\u00e9](https://www.botanical-online.com/plantas-medicinales/cafe-toxicidad-toxicidad), el tabaco, el [alcohol](https://www.botanical-online.com/alcaloides/alcohol-caracteristicas-bebida), el chocolate deben evitarse. Igualmente deben excluirse las carnes, las pastas, caramelo o bebidas con az\u00facar. Principales frutas para realizar una cura de frutas Entre todas ellas podemos destacar las siguientes: LISTA DE DIETAS DEPURATIVAS DE FRUTA Fruta Indicaciones \u00bfC\u00f3mo realizarla? Reumatismo, diabetes, anemia, artritis, gota, h\u00edgado, ves\u00edcula biliar, Contraindicaciones Diabetes, embarazo, lactancia, Fruta Indicaciones \u00bfC\u00f3mo realizarla? Artritis, [acidez de est\u00f3mago](https://www.botanical-online.com/plantas-medicinales/acidez-estomago-plantas-medicinales), [estre\u00f1imiento](https://www.botanical-online.com/dietas/estrenimiento-tratamiento), diarrea, gases [V\u00e9ase como realizar la dieta de la manzana](https://www.botanical-online.com/dietas/manzana-depurativa-dieta-alimentos-buenos) Contraindicaciones Inflamaci\u00f3n intestinal (En este caso se debe hervir) Fruta Indicaciones \u00bfC\u00f3mo realizarla? Reumatismo, artrosis, artritis, gota, colesterol, arteriosclerosis, [\u00e1cido \u00farico](https://www.botanical-online.com/dietas/acido-urico-alto-como-bajar), \u00falcera, acidez, dolor de cabeza, deshidrataci\u00f3n, calor excesivo, obesidad, diarrea, c\u00e1ncer Contraindicaciones Fruta Indicaciones \u00bfC\u00f3mo realizarla? Artritis, gota, estre\u00f1imiento, obesidad, hipertensi\u00f3n, gastritis, retenci\u00f3n de l\u00edquidos Contraindicaciones Diabetes, embarazo, lactancia Fruta Indicaciones \u00bfC\u00f3mo realizarla? Artritis, reumatismo, gota, obesidad, estre\u00f1imiento. \u2014- Contraindicaciones Diabetes, embarazo, lactancia Fruta Indicaciones \u00bfC\u00f3mo realizarla? Artritis, reumatismo \u2014- Contraindicaciones Diabetes, embarazo, lactancia realizarla? Artritis, estre\u00f1imiento, hepatismo, hemorroides, enfermedades card\u00edacas, asma. Contraindicaciones Diabetes, enteritis cr\u00f3nica, gases intestinales, alergias, problemas de la piel Fruta Indicaciones \u00bfC\u00f3mo realizarla? Perder peso, depurativa Contraindicaciones Dieta muy agresiva Desaconsejada por los m\u00e9dicos y especialistas en nutrici\u00f3n OTRAS DIETAS DEPURATIVAS Fruta Indicaciones \u00bfC\u00f3mo realizarla? Obesidad, colesterol, alergias, hipertensi\u00f3n, retenci\u00f3n de l\u00edquidos, antioxidante. Contraindicaciones Dieta muy agresiva no recomendada por muchos especialistas. Nunca recomendada para Fruta Indicaciones \u00bfC\u00f3mo realizarla? Estre\u00f1imiento, obesidad, deporte, Contraindicaciones Diabetes, embarazo, lactancia. Fruta Indicaciones \u00bfC\u00f3mo realizarla? Insuficiencia hep\u00e1tica, Contraindicaciones Diabetes, embarazo, lactancia Fruta Indicaciones \u00bfC\u00f3mo realizarla? Reducir volumen, insuficiencia hep\u00e1tica, obesidad, colesterol alto, Contraindicaciones Diabetes, embarazo, lactancia. Fruta Indicaciones \u00bfC\u00f3mo realizarla? Artritis, gota, estre\u00f1imiento, obesidad, hipertensi\u00f3n, retenci\u00f3n de l\u00edquidos Contraindicaciones Diabetes, embarazo, lactancia. Cuidados y riesgos de realizar dietas depurativas o ayunos Estas dietas deben detenerse en caso de que se produzcan diarreas, v\u00f3mitos, mareos o [ardor de est\u00f3mago](https://www.botanical-online.com/alimentos/acidez-remedios-plantas-medicinales). Muchas veces se producen ciertos s\u00edntomas (dolor de cabeza, fiebre, dolores, etc) que pueden atribuirse a lo que se conoce como crisis depurativa. Estos s\u00edntomas pueden indicar que el organismo se est\u00e1 limpiando. No obstante, en caso de duda, es mejor consultar con el especialista. Lo m\u00e1s conveniente es que este tipo de dietas sean supervisadas por un especialista para que haga un seguimiento de la misma, especialmente si la persona que decide hacerlas no tiene experiencia previa. Esto resulta especialmente conveniente en caso de dietas que superen las 24 horas de duraci\u00f3n. Las dietas depurativas no deben ser realizadas por embarazadas, madres en la lactancia, lactantes, ni\u00f1os, personas con problemas de salud que requieran tratamiento m\u00e9dico, personas que tomen medicamentos ni personas mayores. Las personas con alguna situaci\u00f3n de salud especial deben consultar con el especialista antes de iniciar cualquier tipo de dieta [M\u00e1s informaci\u00f3n](#listado) sobre las propiedades del ayuno y dietas. [Elisenda Carballido](https://www.botanical-online.com/author/eli-carballido)- Dietista nutricionista. Postgrado en Fitoterapia y m\u00e1ster en Nutrici\u00f3n y Metabolismo. [Editorial](https://www.botanical-online.com/quienes-somos)Equipo de Botanical-online encargado de la redacci\u00f3n de contenidos 22 abril, 2019 "}