{"title": "5 razones saludables para consumir el jugo de naranja con zanahoria y la mejor receta para hacerlo", "author": "Rafael Maldonado", "url": "https://www.gastrolabweb.com/bebidas/2023/8/22/razones-saludables-para-consumir-el-jugo-de-naranja-con-zanahoria-la-mejor-receta-para-hacerlo-39696.html", "hostname": "gastrolabweb.com", "description": "La combinaci\u00f3n de nutrientes de la zanahoria y la naranja resulta muy saludable para el organismo, descubre por qu\u00e9.", "sitename": "Jugo de naranja y zanahoria", "date": "2023-08-22", "cleaned_text": "Jugos y Licuados 5 razones saludables para consumir el jugo de naranja con zanahoria y la mejor receta para hacerloLa combinaci\u00f3n de nutrientes de la zanahoria y la naranja resulta muy saludable para el organismo, descubre por qu\u00e9. Tanto las zanahorias como las naranjas son alimentos llenos de nutrientes y propiedades que pueden beneficiar en gran medida tu salud y m\u00e1s a\u00fan si se combinan en una sola preparaci\u00f3n deliciosa, por eso el jugo de naranja con zanahoria resulta tan popular, pues adem\u00e1s de ser bastante rico y tener el balance perfecto entre lo dulce y lo \u00e1cido, tambi\u00e9n es muy saludable. Esta vez te compartiremos 5 razones saludables para consumir este jugo y como prepararlo de la forma perfecta. Antioxidante Este jugo cuenta con una gran cantidad de antioxidantes para tu organismo, por lo que puede ayudarte a prevenir la degeneraci\u00f3n celular y ayudar a tu sistema a protegerse del da\u00f1o de los radicales libres. Fuente de vitaminas Esta bebida tiene una gran carga de vitaminas como vitamina A, vitamina B y vitamina C, lo que convierte al jugo de naranja y zanahoria en una gran ayuda para estimular y fortalecer tu sistema inmunol\u00f3gico ante varias enfermedades, incluidas las estacionales. Depurativo Por si fuera poco, el jugo de naranja y zanahoria tiene efectos depurativos y diur\u00e9ticos en nuestro sistema, lo que permite que esta bebida sea una excelente opci\u00f3n para limpiar el organismo e incluso para incluir en nuestras dietas orientadas a quemar grasa y el adelgazamiento. Mejora la salud de la piel El jugo de naranja en combinaci\u00f3n con el jugo de zanahoria puede mejorar el aspecto de nuestra piel, hidrat\u00e1ndola, haci\u00e9ndola m\u00e1s el\u00e1stica y estimulando la generaci\u00f3n de nutrientes esenciales para esta, as\u00ed mismo puede ayudar a [fortalecer u\u00f1as y cabello](https://www.gastrolabweb.com/postres/2023/8/9/sigue-esta-idea-para-cocinar-la-grenetina-aprovechar-los-beneficios-del-colageno-39267.html) de forma natural. Aporta minerales Esta bebida puede aportar, adem\u00e1s de las vitaminas que mencionamos anteriormente, una amplia gama de minerales entre los que se encuentran [algunos muy importantes para nuestra salud](https://www.gastrolabweb.com/saludable/2023/8/12/que-alimentos-tienen-magnesio-en-que-hora-del-dia-es-mejor-consumirlos-aqui-te-lo-explicamos-39235.html) como el calcio, el f\u00f3sforo, el magnesio y el potasio. Jugo de naranja y zanahoriaRafael Maldonado Ingredientes - 4 naranjas - 2 zanahorias Marcas preferentes: Usa las marcas de tu preferencia.. Preparaci\u00f3n - Pela la zanahoria y ralla para que sea m\u00e1s f\u00e1cil integrar - Corta las naranjas por la mitad y exprime para obtener su jugo - Lic\u00faa el jugo de naranja con la zanahoria rallada hasta obtener un batido uniforme - Sirve y disfruta reci\u00e9n preparado Informaci\u00f3n Nutricional - Calor\u00edas: 151kcal - "}