{"title": "El ingrediente natural, muy apreciado por las abuelas, por sus m\u00faltiples beneficios para la piel", "author": "El Pa\u00eds", "url": "https://www.elpais.com.co/salud/el-ingrediente-natural-muy-apreciado-por-las-abuelas-por-sus-multiples-beneficios-para-la-piel-1437.html", "hostname": "elpais.com.co", "description": "La \u00e1rnica es una planta que adem\u00e1s de ser atractiva para los jardines, tambi\u00e9n cuenta con excelentes beneficios para la salud.", "sitename": "El Pa\u00eds", "date": "2023-06-15", "cleaned_text": "Salud El ingrediente natural, muy apreciado por las abuelas, por sus m\u00faltiples beneficios para la piel La \u00e1rnica es una planta que adem\u00e1s de ser atractiva para los jardines, tambi\u00e9n cuenta con excelentes beneficios para la salud. [15 de junio de 2023](/tag/fecha/2023-06-15/)Por: El Pa\u00eds La \u00e1rnica es una planta medicinal originaria de Europa y Asia, esta se ha utilizado durante siglos para tratar una variedad de afecciones, inflamaciones e incluso para las cicatrices. [En la actualidad esta planta es usado como remedio popular para tratar lesiones musculares, moretones, dolores y tambi\u00e9n cicatrices o marcas de acn\u00e9.](https://www.elpais.com.co/salud/problemas-de-colesterol-estos-son-algunos-remedios-naturales-que-le-ayudaran-a-bajar-los-niveles-0943.html) Esta planta era utilizada desde tiempos inmemoriales para preparar remedios fitoterap\u00e9uticos y homeop\u00e1ticos, ahora se utiliza como ingrediente natural en geles y cremas, pomadas y parches analg\u00e9sicos, y tambi\u00e9n en comprimidos e infusiones. Esto se debe a que, seg\u00fan algunos estudios, tiene ciertos efectos en la circulaci\u00f3n sangu\u00ednea, lo cual podr\u00eda ayudar a acelerar el proceso de recuperaci\u00f3n de varios tipos de lesiones. Esta planta se puede utilizar de distintas maneras como el aceite de \u00e1rnica el cual se puede utilizar antes y despu\u00e9s de hacer deporte, pues es muy popular entre los deportistas, que se la aplican en forma de aceite sobre el cuerpo antes y despu\u00e9s del entrenamiento. Aplicado antes, previene los calambres, y masajeado despu\u00e9s relaja los m\u00fasculos. Tambi\u00e9n se puede usar en gel o crema de \u00e1rnica, con facilidad se puede encontrar en farmacias y tiendas naturistas e Internet. Si se necesita una acci\u00f3n potente, existen geles que pueden tener entre un 98% y un 99% de este principio activo. Otra manera de utilizar esta planta es por medio de remedios caseros, su preparaci\u00f3n es sencilla, solo se necesitan algunas flores secas, se pueden infundir en aceite o remojar en agua para hacer una primera parte del producto. Es primordial saber que estas pueden ser altamente t\u00f3xicas, por lo que no se deben ingerir o aplicar sobre heridas abiertas. Sin embargo, su uso externo tiene muchos beneficios y es 100 % seguro. Crema de \u00e1rnica - \u00bd taza de \u00e1rnica seca (250 g) - \u00bc de taza de cera de abejas rallada (62 g) - \u00bc de taza de manteca de cacao (62 g) - taza de aceite de almendras dulces o semillas de uva (156 g) - \u00bc de cucharadita de b\u00f3rax (1,2 g) - \u00bc de taza de agua destilada (62 ml) Paso a paso En un recipiente que sea resistente al calor, se debe poner a calentar al ba\u00f1o mar\u00eda el aceite con el \u00e1rnica seca durante media hora. Despu\u00e9s es necesario filtrar las flores a trav\u00e9s de una tela o malla y desecha los restos. A la media taza de la infusi\u00f3n de aceite, agregarle la cera de abejas y la manteca de cacao, esto se debe dejar derretir a fuego bajo. Mientras tanto, en otro recipiente, se debe mezclar el b\u00f3rax en el agua y ponlo en el fuego hasta que se caliente bien. Cuando ambas mezclas est\u00e9n en su punto, se deben unir en un solo recipiente (en este paso se debe ser cuidadoso, pues en este paso puede haber una reacci\u00f3n burbujeante). Finalmente, se debe revolver todos los ingredientes hasta que la mezcla tenga un resultado homog\u00e9neo. Dejar reposar y luego batirla un par de minutos para lograr una consistencia cremosa. La crema de \u00e1rnica casera se debe guardar en un frasco herm\u00e9tico y debe ser almacenada en un lugar oscuro. Almacenada en buenas condiciones, esta crema de \u00e1rnica casera puede durar en buenas condiciones entre 3 y 6 meses. Modo de aplicaci\u00f3n Para utilizarla se debe aplicar sobre la piel en peque\u00f1as cantidades y apl\u00edcala para masajear la zona afectada. Sin embargo, no se debe aplicar en la piel abierta. Aceite de \u00e1rnica Se debe colocar en un recipiente aceite de almendras o de oliva junto con las flores del \u00e1rnica y tapar con aluminio, para luego agitar. [El siguiente paso es guardar el recipiente en un lugar con ventilaci\u00f3n y oscuro por al menos un mes.](https://www.elpais.com.co/salud/los-increibles-beneficios-de-colocar-aceite-de-coco-en-tu-cafe-en-ayunas-1409.html) Despu\u00e9s de que la mezcla est\u00e9 reposada, se debe verter en otro envase de vidrio y conservar en un espacio fresco. Las anteriores recetas no deben ser ingeridas, sino usadas en las zonas donde hay dolor muscular o contusiones. "}