{"title": "\"Es segura y efectiva\": Nature publica un art\u00edculo sobre la vacuna Sputnik V", "author": "Sputnik Mundo", "url": "https://sputniknews.lat/20210707/es-segura-y-efectiva-nature-publica-un-articulo-sobre-la-vacuna-sputnik-v-1113866870.html", "hostname": "sputniknews.lat", "description": "La revista cient\u00edfica brit\u00e1nica Nature ha publicado un art\u00edculo acerca de la vacuna rusa contra el coronavirus Sputnik V, en el que habla acerca de su eficacia y seguridad.", "sitename": "Sputnik Mundo", "date": "2021-07-07", "cleaned_text": "publica un art\u00edculo sobre la vacuna Sputnik V \"Es segura y efectiva\": Nature publica un art\u00edculo sobre la vacuna Sputnik V La revista cient\u00edfica brit\u00e1nica Nature ha publicado un art\u00edculo acerca de la vacuna rusa contra el coronavirus Sputnik V, en el que habla acerca de su eficacia... 07.07.2021, Sputnik Mundo 2021-07-07T12:55+0000 2021-07-07T12:55+0000 2021-07-07T12:55+0000 ciencia rusia nature vacunaci\u00f3n contra el covid-19 sputnik v (vacuna) /html/head/meta[@name='og:title']/@content /html/head/meta[@name='og:description']/@content https://cdn2.img.sputniknews.lat/img/07e5/07/07/1113867068_0:225:3079:1956_1920x0_80_0_0_08d65e7d890b27b9157315fbb18d69b7.jpg La publicaci\u00f3n pone de relieve que si bien la temprana aprobaci\u00f3n de la vacuna por parte de las autoridades rusas en agosto de 2020 desat\u00f3 controversia en la comunidad cient\u00edfica, la evidencia obtenida no solo por el pa\u00eds fabricante, sino tambi\u00e9n por muchas otras naciones alrededor del globo, sugiere que Sputnik V \"es segura y efectiva\".El art\u00edculo se\u00f1ala que el f\u00e1rmaco ruso ya se utiliza en casi siete decenas de pa\u00edses, cuyas autoridades nunca han registrado efectos secundarios graves. Es m\u00e1s, pone de relieve que, a diferencia de otros preparados similares, con Sputnik V no se conocen casos de \"condiciones raras de coagulaci\u00f3n de la sangre\". La vacuna rusa todav\u00eda no ha sido aprobada por la Organizaci\u00f3n Mundial de la Salud ni la Agencia Europea de Medicamentos \u2014EMA, por sus siglas en ingl\u00e9s\u2014. Los desarrolladores de Sputnik V han acusado a la Uni\u00f3n Europea de ser parcial a la hora de aprobar los f\u00e1rmacos contra el COVID-19, recuerda Nature.De acuerdo con la vir\u00f3loga canadiense Alyson Kelvin de la Universidad de Dalhousie, consultada por Nature, la vacuna se usa ampliamente en todo el mundo, lo que significa que en el caso de que presentara alg\u00fan problema de seguridad, surgir\u00edan informes acerca de ello.Dmitri Kulish, investigador de biotecnolog\u00eda en el Instituto de Ciencia y Tecnolog\u00eda Skolkovo en Mosc\u00fa, agreg\u00f3 que Argentina no ha reportado ning\u00fan evento de coagulaci\u00f3n, a pesar de haber recibido m\u00e1s de cuatro millones de dosis de la vacuna. Tampoco lo hizo Serbia, pa\u00eds en donde tambi\u00e9n se ha estado usando Sputnik V ampliamente. https://sputniknews.lat/20210629/creadores-de-sputnik-v-destacan-la-eficacia-de-su-vacuna-contra-la-variante-delta-de-covid-1113629119.html https://sputniknews.lat/20210702/argentina-sputnik-v-tiene-933-de-efectividad-para-prevenir-muertes-1113765434.html Sputnik Mundo [ [ ](https://www.tiktok.com/@sputnik.mundo) [ ](https://www.threads.net/@sputnikmundo) rusia, nature, vacunaci\u00f3n contra el covid-19, sputnik v (vacuna) rusia, nature, vacunaci\u00f3n contra el covid-19, sputnik v (vacuna) \"Es segura y efectiva\": Nature publica un art\u00edculo sobre la vacuna Sputnik V La revista cient\u00edfica brit\u00e1nica Nature ha publicado un art\u00edculo acerca de la vacuna rusa contra el coronavirus Sputnik V, en el que habla acerca de su eficacia y seguridad. La publicaci\u00f3n pone de relieve que si bien la temprana aprobaci\u00f3n de la vacuna por parte de las autoridades rusas en agosto de 2020 desat\u00f3 controversia en la comunidad cient\u00edfica, la evidencia obtenida no solo por el pa\u00eds fabricante, sino tambi\u00e9n por muchas otras naciones alrededor del globo, sugiere que Sputnik V \"es segura y efectiva\". 29 de junio 2021, 12:53 GMT El [art\u00edculo](https://www.nature.com/articles/d41586-021-01813-2) se\u00f1ala que el f\u00e1rmaco ruso ya se utiliza en casi siete decenas de pa\u00edses, cuyas autoridades nunca han registrado efectos secundarios graves . Es m\u00e1s, pone de relieve que, a diferencia de otros preparados similares, con Sputnik V no se conocen casos de \"condiciones raras de coagulaci\u00f3n de la sangre\". \"A diferencia de las vacunas Oxford-AstraZeneca y Johnson & Johnson, no ha habido informes de estos trastornos por parte de las autoridades sanitarias rusas o de otras naciones que utilizan Sputnik V\", subraya el art\u00edculo. La vacuna rusa todav\u00eda no ha sido aprobada por la Organizaci\u00f3n Mundial de la Salud ni la Agencia Europea de Medicamentos \u2014EMA, por sus siglas en ingl\u00e9s\u2014. Los desarrolladores de Sputnik V han acusado a la Uni\u00f3n Europea de ser parcial a la hora de aprobar los f\u00e1rmacos contra el COVID-19, recuerda Nature. De acuerdo con la vir\u00f3loga canadiense Alyson Kelvin de la Universidad de Dalhousie, consultada por Nature, la vacuna se usa ampliamente en todo el mundo, lo que significa que en el caso de que presentara alg\u00fan problema de seguridad, surgir\u00edan informes acerca de ello. Dmitri Kulish, investigador de biotecnolog\u00eda en el Instituto de Ciencia y Tecnolog\u00eda Skolkovo en Mosc\u00fa, agreg\u00f3 que [Argentina](https://mundo.sputniknews.com/20210702/laboratorio-de-argentina-concluye-produccion-de-550000-dosis-de-vacuna-sputnik-v-1113761847.html) no ha reportado ning\u00fan evento de coagulaci\u00f3n, a pesar de haber recibido m\u00e1s de cuatro millones de dosis de la vacuna. Tampoco lo hizo Serbia, pa\u00eds en donde tambi\u00e9n se ha estado usando Sputnik V ampliamente. 2 de julio 2021, 22:04 GMT \"Actualmente se est\u00e1n realizando varios estudios en pa\u00edses que han aprobado Sputnik, incluidos Argentina, Venezuela, Rusia y Turqu\u00eda, lo que debe ayudar a construir una imagen m\u00e1s precisa de la seguridad y eficacia de la vacuna\", concluy\u00f3 Nature. "}