{"title": "Estados Miembros de OPS aprueban resoluci\u00f3n para apoyar acceso equitativo a vacuna contra viruela s\u00edmica en las Am\u00e9ricas", "author": "Plenilunia Salud Mujer", "url": "https://plenilunia.com/noticias-2/estados-miembros-de-ops-aprueban-resolucion-para-apoyar-acceso-equitativo-a-vacuna-contra-viruela-simica-en-las-americas/88689/", "hostname": "plenilunia.com", "description": "Mientras los casos de viruela s\u00edmica siguen en aumento en varios pa\u00edses de las Am\u00e9ricas, los Estados Miembros de la Organizaci\u00f3n Panamericana de la Salud", "sitename": "Plenilunia", "date": "2022-08-06", "cleaned_text": "Estados Miembros de OPS aprueban resoluci\u00f3n para apoyar acceso equitativo a vacuna contra viruela s\u00edmica en las Am\u00e9ricas Mientras los casos de viruela s\u00edmica siguen en aumento en varios pa\u00edses de las Am\u00e9ricas, los Estados Miembros de la Organizaci\u00f3n Panamericana de la Salud (OPS) celebraron este 5 de agosto de 2022 una sesi\u00f3n especial de su Consejo Directivo para considerar una resoluci\u00f3n para hacer frente al brote, que incluye el apoyo al acceso equitativo a la vacuna para las poblaciones en mayor riesgo. Antecedentes El 23 de julio de 2022, el Director General de la Organizaci\u00f3n Mundial de la Salud (OMS) declar\u00f3 el brote de viruela s\u00edmica como una emergencia de salud p\u00fablica de importancia internacional. El brote actual comenz\u00f3 a mediados de mayo y ha afectado hasta ahora a 89 pa\u00edses de todo el mundo. En las Am\u00e9ricas, se han notificado alrededor de 10 mil infecciones por viruela s\u00edmica en 24 pa\u00edses desde el inicio del brote, lo que representa el 36% de los casos mundiales. Recomendaciones \"La declaraci\u00f3n de emergencia de salud p\u00fablica de importancia internacional vino con recomendaciones detalladas tanto para los pa\u00edses y territorios que no han detectado ning\u00fan caso como para los que ya tienen casos importados o transmisi\u00f3n en sus comunidades\", dijo la directora de la OPS, Carissa F. Etienne. \"Creemos que cuando las medidas recomendadas se aplican adecuadamente, podemos detener la transmisi\u00f3n del virus de la viruela s\u00edmica\", consider\u00f3. Estas recomendaciones, que la OPS est\u00e1 trabajando con los Estados Miembros para ponerlas en pr\u00e1ctica, incluyen: - comunicaci\u00f3n de riesgos y la participaci\u00f3n de las comunidades afectadas - Detecci\u00f3n temprana y la vigilancia - Tratamiento y el aislamiento de los pacientes - Seguimiento de los contactos [Te recomendamos: Se realiz\u00f3 cent\u00e9sima primera reuni\u00f3n entre autoridades del IMSS con madres y padres de pacientes pedi\u00e1tricos oncol\u00f3gicos, impulsar\u00e1n programa de rehabilitaci\u00f3n integral ](https://plenilunia.com/cancer/se-realizo-centesima-primera-reunion-entre-autoridades-del-imss-con-madres-y-padres-de-pacientes-pediatricos-oncologicos-impulsaran-programa-de-rehabilitacion-integral/89321/) Sin embargo, \"la vacunaci\u00f3n posterior o previa a la exposici\u00f3n podr\u00eda ser un complemento de las dem\u00e1s medidas\", a\u00f1adi\u00f3 la Directora de OPS. Vacunaci\u00f3n Durante la sesi\u00f3n, la doctora Etienne se\u00f1al\u00f3 que actualmente solo existe una vacuna de tercera generaci\u00f3n contra la viruela s\u00edmica en el mundo, y es elaborada por un solo productor. Aunque los suministros de estas vacunas son extremadamente limitados, la OPS ha entablado las primeras negociaciones con su productor. En vista de ello, la resoluci\u00f3n adoptada solicita a la Directora de la OPS que facilite una respuesta coordinada y tome medidas para apoyar a sus Estados Miembros a tener acceso a esta vacuna a trav\u00e9s del Fondo Rotatorio de la organizaci\u00f3n. Asimismo, solicita que los pa\u00edses de la regi\u00f3n de las Am\u00e9ricas contin\u00faen reconociendo a la OPS y a su Fondo Rotatorio como el mecanismo t\u00e9cnico regional estrat\u00e9gico m\u00e1s adecuado para brindar un acceso equitativo a esta y otras vacunas. Las recomendaciones del Grupo T\u00e9cnico Asesor de la OPS sobre Enfermedades Prevenibles por Vacunaci\u00f3n, as\u00ed como las del Comit\u00e9 de Emergencia del Reglamento Sanitario Internacional, convocado por la OMS, estipulan que los pa\u00edses deben priorizar las vacunas para grupos espec\u00edficos; as\u00ed como los contactos cercanos de un caso confirmado. Esto con el fin de maximizar el impacto de las vacunas teniendo en cuenta el suministro limitado. Enfermedad de viruela s\u00edmica La viruela s\u00edmica es una enfermedad zoon\u00f3tica viral causada por el virus de la viruela s\u00edmica, tambi\u00e9n conocida como viruela del mono. Los s\u00edntomas incluyen: - fiebre - dolor de cabeza intenso - inflamaci\u00f3n de los ganglios linf\u00e1ticos - dolor muscular - una erupci\u00f3n que forma ampollas y costras [Te recomendamos: Senado exhorta a cumplir con NOM para especificar en etiquetas los alimentos que se encuentren libres de gluten](https://plenilunia.com/nutricion/senado-exhorta-a-cumplir-con-nom-para-especificar-en-etiquetas-los-alimentos-que-se-encuentren-libres-de-gluten/39775/) La erupci\u00f3n suele concentrarse en la cara, las palmas de las manos y las plantas de los pies. La boca, los genitales y los ojos tambi\u00e9n pueden verse afectados. S\u00edntomas Los s\u00edntomas pueden ser leves o graves y suelen durar varias semanas, durante las cuales la persona puede contagiar a otras. La mayor\u00eda de las personas se recuperan en pocas semanas sin tratamiento. Avances de la enfermedad en el mundo La enfermedad de la viruela s\u00edmica se registra regularmente en 9 pa\u00edses de \u00c1frica Central y Occidental desde que se reconoci\u00f3 por primera vez en 1958 en la Rep\u00fablica Democr\u00e1tica del Congo. Sin embargo, desde mediados de mayo de 2022, se ha notificado un n\u00famero creciente de casos, primero en m\u00faltiples pa\u00edses de Europa y despu\u00e9s en otras regiones, incluidas las Am\u00e9ricas. Hasta el 4 de agosto de 2022 se notificaron a la OMS un total de 26.326 casos probables y confirmados por laboratorio en 89 pa\u00edses del mundo. Sitios de inter\u00e9s - Sesi\u00f3n especial del Consejo Directivo de la OPS - viruela s\u00edmica | [https://www.paho.org/es/cuerpos-directivos/consejo-directivo/sesion-especial-consejo-directivo](https://plenilunia.com/noticias-2/estados-miembros-de-ops-aprueban-resolucion-para-apoyar-acceso-equitativo-a-vacuna-contra-viruela-simica-en-las-americas/88689/?xurl=https://www.paho.org/es/cuerpos-directivos/consejo-directivo/sesion-especial-consejo-directivo) - Recomendaciones temporales emitidas por el Director General de la OMS en relaci\u00f3n con el brote de viruela s\u00edmica en varios pa\u00edses | [https://www.who.int/es/news/item/23-07-2022-second-meeting-of-the-international-health-regulations-(2005)-(ihr)-emergency-committee-regarding-the-multi-country-outbreak-of-monkeypox](https://plenilunia.com/noticias-2/estados-miembros-de-ops-aprueban-resolucion-para-apoyar-acceso-equitativo-a-vacuna-contra-viruela-simica-en-las-americas/88689/?xurl=https://www.who.int/es/news/item/23-07-2022-second-meeting-of-the-international-health-regulations-(2005)-(ihr)-emergency-committee-regarding-the-multi-country-outbreak-of-monkeypox) - Brote por enfermedad de viruela s\u00edmica - 2022 | [https://www.paho.org/es/brote-por-enfermedad-viruela-simica-2022](https://plenilunia.com/noticias-2/estados-miembros-de-ops-aprueban-resolucion-para-apoyar-acceso-equitativo-a-vacuna-contra-viruela-simica-en-las-americas/88689/?xurl=https://www.paho.org/es/brote-por-enfermedad-viruela-simica-2022) - Tablero de casos de viruela s\u00edmica en "}