{"title": "15 champ\u00fas para cabellos grasos que evitan que se ensucie tan deprisa", "author": "Magdalena Fraj", "url": "https://www.elle.com/es/belleza/pelo/g38080740/champus-cabellos-grasos/", "hostname": "elle.com", "description": "Te contamos c\u00f3mo combatir el exceso de sebo capilar para lucir el pelo limpio durante m\u00e1s tiempo. \u00a1No te lo pierdas!", "sitename": "ELLE", "date": "2023-09-13", "cleaned_text": "de afiliaci\u00f3n de marketing, lo que significa que ELLE recibe comisiones de las compras hechas a trav\u00e9s de los links a sitios de los vendedores. 15 champ\u00fas para cabellos grasos que evitan que se ensucie tan deprisa Te contamos c\u00f3mo combatir el exceso de sebo capilar para lucir el pelo limpio durante m\u00e1s tiempo. \u00a1No te lo pierdas! [Magdalena Fraj](/es/author/221184/magdalena-fraj/) [Tener el pelo graso](https://www.elle.com/es/belleza/pelo/a19700203/como-cuidar-pelo-graso/) es uno de los problemas 'beauty' que m\u00e1s quebraderos de cabeza nos da. Mantenerlo suave y brillante durante m\u00e1s de 24 horas en la mayor\u00eda de ocasiones resulta misi\u00f3n imposible. Pero si no duras ni un d\u00eda con [el pelo limpio](https://www.elle.com/es/belleza/pelo/g794728/como-mantener-el-pelo-limpio-durante-mas-tiempo/) (y siempre est\u00e1s buscando [los mejores peinados](https://www.elle.com/es/belleza/pelo/a37310054/pelo-graso-seis-peinados-para-cuando-tienes-prisa-y-tienes-pelo-sucio/) para hacerte cuando tienes prisa y lo tienes sucio), no te preocupes. Hemos hablado con una experta para descubrir c\u00f3mo cuidar el cabello graso para que siempre luzca bonito, radiante y aguante m\u00e1s tiempo limpio. Adem\u00e1s, hemos seleccionado para ti [los mejores champ\u00fas](https://www.elle.com/es/belleza/pelo/a32220383/champu-como-elegir/) con los que conseguir\u00e1s pasar de 'pelito' a 'pelazo' en tiempo r\u00e9cord. \u00bfEmpezamos? Por qu\u00e9 siempre tienes el pelo graso \" [El cuero cabelludo](https://www.elle.com/es/belleza/pelo/a28363020/trucos-consejos-cuero-cabelludo-limpio-sano/) graso se caracteriza por una hiperseborrea, es decir, un exceso de producci\u00f3n de sebo que se acumula en las ra\u00edces, que atrapa el polvo presente en el aire y que le da al pelo un aspecto sucio, pesado, grasiento... Aunque es una condici\u00f3n habitual durante la adolescencia, algunas mujeres y hombres pueden sufrirlo tambi\u00e9n en la edad adulta\", se\u00f1ala la farmac\u00e9utica Roc\u00edo Escalante, titular de [Arbosana Farmacia](http://arbosanafarmacia.es/). \u00bfPor qu\u00e9 algunos cabellos se engrasan con facilidad? \"Hay varias razones, como, por ejemplo, un desequilibrio hormonal o el hecho de tener [la piel grasa](https://www.elle.com/es/livemore/more-beauty/a19714655/cuidados-piel-grasa/) (que suele ir asociado con el pelo graso). Otros factores como el estr\u00e9s, una alimentaci\u00f3n rica en grasas y dulces o el uso de productos agresivos pueden aumentar el problema\", se\u00f1ala la experta. \u00bfC\u00f3mo cuidar el pelo graso? Para cuidar el pelo graso \"es esencial elegir un champ\u00fa formulado para este tipo de cabello. Estos productos normalmente tienen ingredientes antif\u00fangicos y antibacterianos, que regulen el exceso de grasa y logren mantener el pelo limpio m\u00e1s tiempo. Por otra parte, es importante saber que la frecuencia de lavado no influye en la producci\u00f3n de grasa, es decir, que por lavarlo m\u00e1s no tendremos m\u00e1s grasa. As\u00ed que es aconsejable [lavar el pelo](https://www.elle.com/es/belleza/pelo/a31975733/lavar-pelo-champu-video/) graso siempre que se note sucio y, si es necesario, a diario. De hecho, es m\u00e1s perjudicial dejar la grasa sobre el cuero cabelludo que lavarlo a diario. Si se lava a diario, bastar\u00e1 con una aplicaci\u00f3n de champ\u00fa. [Recoger el pelo](https://www.elle.com/es/belleza/pelo/g28333665/monos-tendencia-peinados-recogidos/), evitar tocarlo, prescindir del flequillo, limitar el uso de [las planchas](https://www.elle.com/es/belleza/pelo/g38043506/mejores-planchas-pelo/) y [secadores ](https://www.elle.com/es/belleza/pelo/g37993191/secadores-pelo-pequenos-viajar/)son algunos trucos que pueden ayudar a prolongar la limpieza del cabello graso\", destaca Roc\u00edo Escalante. Los mejores champ\u00fas para el pelo graso Si ya sabes c\u00f3mo tienes que cuidar el pelo graso, ahora toca elegir el champ\u00fa adecuado. Aqu\u00ed te dejamos los productos mejor valorados en Amazon. \u00a1Toma nota! VER V\u00cdDEO Las sneakers de Bimba & Lola que son tendencia Los mejores parches de hidrogel para las ojeras Rellenadores de labios con \u00e1cido hialur\u00f3nico Amazon vende "}