{"title": "Farmacias M\u00e9dicor: \u00a1Lo natural es sentirme bien...!", "author": "Medicor", "url": "https://farmaciasmedicor.com/", "hostname": "farmaciasmedicor.com", "description": "Bienvenido al mundo saludable de Farmacias M\u00e9dicor Aqu\u00ed", "sitename": "Farmacias M\u00e9dicor", "date": "2019-02-25", "cleaned_text": "DESCANSA NATURALMENTE LA MEJOR FORMA DE CONCILIAR EL SUE\u00d1O COMBATE EL INSOMNIO SIN EFECTOS SECUNDARIOS RECUPERA TU ENERG\u00cdA RESTAURA LA ENERG\u00cdA VITAL DE TU CUERPO Bienvenido al mundo saludable de Farmacias M\u00e9dicor Aqu\u00ed encontrar\u00e1s TINTURAS | DILUCIONES | ESPECIALIDADES | [SALES DE SCH\u00dcSSLER](https://farmaciasmedicor.com/sales-de-schuessler/)| [FLORES DE BACH](https://farmaciasmedicor.com/productos/flores-de-bach/)| TABLETAS | GL\u00d3BULOS | AROMATERAPIA | Suplemento Alimenticios | SNACKS NUTRITIVOS Conoce por qu\u00e9 te conviene m\u00e1s - La homeopat\u00eda es un remedio seguro basado en principios naturales. - La homeopat\u00eda es una medicina no invasiva. - Puede usarse de forma segura en conjunto de otros tratamientos. - No presenta efectos secundarios adversos. - Puede ser aplicada sin riesgos en ni\u00f1os, en personas de la tercera edad y en mujeres embarazadas o durante la lactancia. PROMOCIONES INSCR\u00cdBETE Y APROVECHA GRANDES DESCUENTOS PRODUCTOS DESTACADOS MEDICAMENTOS POR AFECCI\u00d3N Para afecciones en la mujer Para afecciones del coraz\u00f3n Para afecciones de la piel Tratamiento de algunos casos de obesidad. "}