{"title": "Traditional Chinese Medicine (TCM) Market Size, Trend, Analysis 2023-2030", "author": "The Express Wire", "url": "https://www.benzinga.com/pressreleases/23/08/34136752/traditional-chinese-medicine-tcm-market-size-trend-analysis-2023-2030", "hostname": "benzinga.com", "description": "Latest Traditional Chinese Medicine (TCM) Market Growth Analysis 2023Traditional Chinese Medicine (TCM) Market 2023 with 118 Pages Report and enhance with extents shares into sub-counties are covered in this market.", "sitename": "Benzinga", "date": "2023-08-31", "cleaned_text": "Latest Traditional Chinese Medicine (TCM) Market Growth Analysis 2023 [Traditional Chinese Medicine (TCM) Market 2023](https://www.360marketupdates.com/enquiry/request-sample/23951532) with 118 Pages Report and enhance with extents shares into sub-counties are covered in this market. Traditional Chinese Medicine (TCM) Market conditions can be influenced by a wide range of factors, including economic policies, geopolitical events, and technological developments. Major Key Players of the Market: - Misha Ruth Cohen - TCM Australia - Beijing TongRenTang - Dublin Chinese Medicine Clinic - Medical Qigong Centre and Acupuncture Clinic - Healthy Lifestyle Brands, LLC. - NZ Chinese Medicine and Acupuncture Society - Sacred Lotus - ChinaMed Charlottesville - ACTCM - TCM Shanghai - ICTCM House Get a Sample PDF of report @ [https://www.360marketupdates.com/enquiry/request-sample/23951532](https://www.360marketupdates.com/enquiry/request-sample/23951532) Browse Market Size, charts, tables and figures extent in-depth TOC with 118 Report Pages on Traditional Chinese Medicine (TCM) Market by Application (Healthcare, Treatment, Others, ), by Type (Chinese Herbal Medicine, Acupuncture, Cupping, Tui Na, Others, , ) Business Outlook, Top Companies, Key Regions, Product Demand, Market Size and Growth. Traditional Chinese Medicine (TCM) market focuses on analyzing the current competitive situation in the Traditional Chinese Medicine (TCM) market and provides basic information, market data, product introductions, etc. of leading companies in the industry. At the same time, includes the highlighted analysis--Strategies for Company to Deal with the Impact of COVID-19, It may also be helpful to consult with a financial who can provide direction based on your specific financial situation and goals. [TO KNOW HOW COVID-19 PANDEMIC AND RUSSIA UKRAINE WAR WILL IMPACT THIS MARKET - REQUEST SAMPLE](https://www.360marketupdates.com/enquiry/equest-covid19/23951532) COVID-19 has had a significant impact on many industries. The pandemic has disrupted global supply chains, leading to shortages of certain goods and materials. It has also resulted in decreased demand for some products and services, as people have been staying home more and spending less money on non-essential items. Many businesses have had to close temporarily or permanently due to lockdowns and social distancing measures. Some industries, such as healthcare, online retail, and delivery services, have seen an increase in demand as a result of the pandemic. Overall, the COVID-19 pandemic has had a significant and far-reaching impact on the global economy. The global Traditional Chinese Medicine (TCM) market size was valued at USD Million in 2022 and will reach USD Million in 2028, with a CAGR of Percent during 2022-2028. The Traditional Chinese Medicine (TCM) market report covers sufficient and comprehensive data on market introduction, segmentations, status and trends, opportunities and challenges, industry chain, competitive analysis, company profiles, and trade statistics, etc. It provides in-depth and all-scale analysis of each segment of types, applications, players, 5 major regions and sub-division of major countries, and sometimes end user, channel, technology, as well as other information individually tailored before order confirmation. Meticulous research and analysis were conducted during the preparation process of the report. The qualitative and quantitative data were gained and verified through primary and secondary sources, which include but not limited to Magazines, Press Releases, Paid Databases, Maia Data Center, National Customs, Annual Reports, Public Databases, Expert interviews, etc. Besides, primary sources include extensive interviews of key opinion leaders and industry experts such as experienced front-line staff, directors, CEOs, and marketing executives, downstream distributors, as well as end-clients. In this report, the historical period starts from 2018 to 2022, and the forecast period ranges from 2023 to 2028. The facts and data are demonstrated by tables, graphs, pie charts, and other pictorial representations, which enhances the effective visual representation and decision-making capabilities for business strategy. This study also covers company profiling, specifications and product picture, sales, market share and contact information of various regional, international and local vendors of Traditional Chinese Medicine (TCM) Market. The market proposition is frequently developing ahead with the rise in scientific innovation and MandA activities in the industry. Additionally, many local and regional vendors are offering specific application products for varied end-users. The new merchant applicants in the market are finding it hard to compete with the international vendors based on reliability, quality and modernism in technology. Feel Free to Ask Question Before Purchasing the Report at [https://www.360marketupdates.com/enquiry/pre-order-enquiry/23951532](https://www.360marketupdates.com/enquiry/pre-order-enquiry/23951532) Market split by Type, can be divided into: - - Chinese Herbal Medicine - Acupuncture - Cupping - Tui Na - Others Market split by Application, can be divided into: - - Healthcare - Treatment - Others Market segment by Region/Country including: - -North America (United States, Canada and Mexico) -Europe (Germany, UK, France, Italy, Russia and Spain etc.) -Asia-Pacific (China, Japan, Korea, India, Australia and Southeast Asia etc.) -South America (Brazil, Argentina and Colombia etc.) -Middle East and Africa (South Africa, UAE and Saudi Arabia etc.) FIVE FORCES and PESTLE ANALYSIS: In order to better understand Market condition five forces analysis is conducted that includes Bargaining power of buyers, Bargaining power of suppliers, Threat of new entrants, Threat of substitutes, Threat of rivalry. -Political (Political policy and stability as well as trade, fiscal and taxation policies) -Economical (Interest rates, employment or unemployment rates, raw material costs and foreign exchange rates) -Social (Changing family demographics, education levels, cultural trends, attitude changes and changes in lifestyles) -Technological (Changes in digital or mobile technology, automation, research and development) -Legal (Employment legislation, consumer law, health and safety, international as well as trade regulation and restrictions) -Environmental (Climate, recycling procedures, carbon footprint, waste disposal and sustainability) Key takeaways from the Traditional Chinese Medicine (TCM) market report: Detailed considerate of Traditional Chinese Medicine (TCM) market-particular drivers, Trends, constraints, Restraints, Opportunities and major micro markets. Comprehensive valuation of all prospects and threat in the In depth study of industry strategies for growth of the Traditional Chinese Medicine (TCM) market-leading players. Traditional Chinese Medicine (TCM) market latest innovations and major procedures. Favorable dip inside Vigorous high-tech and market latest trends remarkable the Market. Conclusive study about the growth conspiracy of Traditional Chinese Medicine (TCM) market for forthcoming years. [Get a Sample Copy of the Traditional Chinese Medicine (TCM) Market Report 2023(Latest Updated Report)](https://www.360marketupdates.com/enquiry/request-sample/23951532) Detailed TOC of Global Traditional Chinese Medicine (TCM) Market Insights and Forecast to 2030 Major Points from Table of Contents Global Traditional Chinese Medicine (TCM) Market Research Report 2023-2030, by Manufacturers, Regions, Types and Applications 1 Introduction 1.1 Objective of the Study 1.2 Definition of the Market 1.3 Market Scope 1.3.1 Market Segment by Type, Application and Marketing Channel 1.3.2 Major Regions Covered (North America, Europe, Asia Pacific, Mid East and Africa) 1.4 Years Considered for the Study (2015-2030) 1.5 Currency Considered (U.S. Dollar) 1.6 Stakeholders 2 Key Findings of the Study 3 Market Dynamics 3.1 Driving Factors for this Market 3.2 Factors Challenging the Market 3.3 Opportunities of the Global Traditional Chinese Medicine (TCM) Market (Regions, Growing/Emerging Downstream Market Analysis) 3.4 Technological and Market Developments in the Traditional Chinese Medicine (TCM) Market 3.5 Industry News by Region 3.6 Regulatory Scenario by Region/Country 3.7 Market Investment Scenario Strategic Recommendations Analysis 4 Value Chain of the Traditional Chinese Medicine (TCM) Market 4.1 Value Chain Status 4.2 Upstream Raw Material Analysis 4.3 Midstream Major Company Analysis (by Manufacturing Base, by Product Type) 4.4 Distributors/Traders 4.5 Downstream Major Customer Analysis (by Region) 5 Global Traditional Chinese Medicine (TCM) Market-Segmentation by Type 6 Global Traditional Chinese Medicine (TCM) Market-Segmentation by Application 7 Global Traditional Chinese Medicine (TCM) Market-Segmentation by Marketing Channel 7.1 Traditional Marketing Channel (Offline) 7.2 Online Channel 8 Competitive Intelligence Company Profiles 9 Global Traditional Chinese Medicine (TCM) Market-Segmentation by Geography 9.1 North America 9.2 Europe 9.3 Asia-Pacific 9.4 Latin America 9.5 Middle East and Africa 10 Future Forecast of the Global Traditional Chinese Medicine (TCM) Market from 2023-2030 10.1 Future Forecast of the Global Traditional Chinese Medicine (TCM) Market from 2023-2030 Segment by Region 10.2 Global Traditional Chinese Medicine (TCM) Production and Growth Rate Forecast by Type (2023-2030) 10.3 Global Traditional Chinese Medicine (TCM) Consumption and Growth Rate Forecast by Application (2023-2030) 11 Appendix 11.1 Methodology 12.2 Research Data Source Continued Reasons to buy this report: -Identify the latest developments, market shares and strategies employed by the major market players. -Analysing various perspectives of the market with the help of Porters five forces analysis -Study on the product type and application expected to dominate the market. -Study on the country expected to witness fastest growth during the forecast period. -Forecasts the market value by assessing the impact of the market drivers and constraints. Purchase this report (Price USD 3480 for a single-user license) @ [https://www.360marketupdates.com/purchase/23951532](https://www.360marketupdates.com/purchase/23951532) This data has been validated by the business investigators, giving huge bits of knowledge to the scientists, data analysts, directors, and other industry experts. The study deeply helps in understanding the market patterns, applications, determinations and industry obstacles. Contact Us: 360 market updates Phone:USA: Web: Release Distributed by [ The Express Wire ](http://www.theexpresswire.com/) To view the original version on The Express Wire visit [Traditional Chinese Medicine (TCM) Market Size, Trend, Analysis 2023-2030](https://www.theexpresswire.com/pressrelease/Traditional-Chinese-Medicine-TCM-Market-Size-Trend-Analysis-2023-2030_23069047) COMTEX_439292333/2598/2023-08-31T05:37:46 \u00a9 2023 Benzinga.com. Benzinga does not provide investment advice. All rights reserved. "}