{"title": "La EMA concluye tras investigar los casos que la vacuna de AstraZeneca es segura y eficaz", "author": "Nacho Alarc\u00f3n", "url": "https://www.elconfidencial.com/mundo/europa/2021-03-18/la-ema-sentencia-tras-investigar-los-casos-la-vacuna-de-astrazeneca-es-segura-y-eficaz_2998244/", "hostname": "elconfidencial.com", "description": "La Agencia Europea del Medicamento (EMA) ha analizado los casos de trombosis e insiste a los Estados miembros en que es necesario seguir con la vacunaci\u00f3n", "sitename": "El Confidencial", "date": "2021-03-18", "cleaned_text": "La EMA concluye tras investigar los casos que la vacuna de AstraZeneca es segura y eficaz La Agencia Europea del Medicamento (EMA) ha analizado los casos de trombosis e insiste a los Estados miembros en que es necesario seguir con la vacunaci\u00f3n La Agencia Europea del Medicamento (EMA), tras revisar las pruebas de los casos de trombosis en pacientes que hab\u00edan recibido la vacuna de AstraZeneca, ha dictaminado este jueves que los beneficios de la vacuna superan ampliamente a los riesgos, y recomienda a los Estados miembros que contin\u00faen con la vacunaci\u00f3n, aunque, eso s\u00ed, continuar\u00e1 inverstigando los posibles casos de \"extra\u00f1os\" trombos que se han reportado durante los \u00faltimos d\u00edas. \"El comit\u00e9 ha llegado a una clara conclusi\u00f3n cient\u00edfica: esta es una vacuna segura\", ha asegurado Emer Cooke, directora ejecutiva de la EMA, que ha se\u00f1alado que \"la vacuna no est\u00e1 asociada con un incremento general de eventos de trombosis\". Cooke s\u00ed que ha explicado que las investigaciones sobre los casos de trombosis no permiten \"descartar definitivamente una vinculaci\u00f3n\", pero la EMA insiste en que los beneficios son \"mucho mayores\" que los riesgos. Adem\u00e1s, la Agencia ha explicado que \"no hay evidencia de un problema relacionado con lotes espec\u00edficos de la vacuna o con sitios de fabricaci\u00f3n particulares\". \"Hemos visto casos muy extra\u00f1os\", ha explicado la doctora Sabine Straus, la presidenta del Comit\u00e9 de Evaluaci\u00f3n de Riesgos de Farmacovigilancia (PRAC), que ha dirigido los trabajos de investigaci\u00f3n durante los \u00faltimos d\u00edas. Eso s\u00ed, el PRAC continuar\u00e1 sus pesquisas durante las pr\u00f3ximas semanas y ha recomendado dar informaci\u00f3n al p\u00fablico y los profesionales de la salud sobre estos posibles casos y sus s\u00edntomas. \"Si fuera por m\u00ed yo querr\u00eda ser vacunada ma\u00f1ana, pero querr\u00eda saber. Pero querr\u00eda saber que qu\u00e9 debo hacer al respecto si algo me pasa despu\u00e9s de la vacunaci\u00f3n\", ha explicado Cooke, que ha subrayado que por eso se quiere aumentar la informaci\u00f3n. La Agencia se\u00f1ala que algunos de los s\u00edntomas que deber\u00edan observarse tras recibir la inyecci\u00f3n con AstraZeneca ser\u00eda la falta de aliento, dolor en el pecho o el est\u00f3mago, hinchaz\u00f3n o frialdad en un brazo o una pierna, dolor de cabeza intenso o visi\u00f3n borrosa tras la vacunaci\u00f3n, sangrado persistente, o m\u00faltiples hematomas, manchas rojizas o ampollas de sangre debajo de la piel. Por otro lado Straus ha se\u00f1alado que el propio coronavirus tiene \"un papel en el aumento de los eventos tromboemb\u00f3licos\". Los expertos tambi\u00e9n han explicado que estos casos se est\u00e1n identificando por ahora m\u00e1s entre mujeres y tambi\u00e9n entre las m\u00e1s j\u00f3venes. \"Casi todos los casos notificados correspondieron a mujeres menores de 55 a\u00f1os\", ha se\u00f1alado la EMA en un comunicado, aunque rechaza llegar a conclusiones con esos datos, ya que por ahora la mayor\u00eda de las personas vacunadas son mujeres y entre la poblaci\u00f3n joven vacunada muchas son mujeres que trabajan en los sistemas sanitarios de los Veintisiete. La semana pasada un primer grupo de Estados miembros fren\u00f3 la vacunaci\u00f3n con AstraZeneca debido a varias muertes por trombosis en pacientes que hab\u00edan recibido la inyecci\u00f3n con la f\u00f3rmula de la farmac\u00e9utica anglosueca. Entonces la EMA ya reaccion\u00f3 se\u00f1alando que, si bien iba a investigar la situaci\u00f3n, recomendaba seguir utilizando la vacuna. El lunes lleg\u00f3 el turno de Alemania, Francia, Italia y Espa\u00f1a. La Agencia, con base en \u00c1msterdam, repiti\u00f3 el mensaje: se estaba investigando, pero mientras tanto los beneficios superan a los riesgos. [\u00bfQu\u00e9 pasar\u00eda si toda Espa\u00f1a se pusiera la vacuna de AstraZeneca contra el covid-19?](https://www.elconfidencial.com/espana/coronavirus/2021-03-18/covid19-astrazeneca-vacuna-efectos-adversos_2996120/) Pa\u00edses como Espa\u00f1a o Francia hab\u00edan frenado la vacunaci\u00f3n se\u00f1alando que esperar\u00edan a tener una conclusi\u00f3n por parte de la EMA. \"Muchos estados miembros est\u00e1n esperando este resultado de la revisi\u00f3n de seguridad y nos han indicado que lo que ha hecho la EMA desde una perspectiva cient\u00edfica es muy importante para que tomen una decisi\u00f3n sobre c\u00f3mo continuar\", ha explicado Cook durante una rueda de prensa celebrada este jueves. En su evaluaci\u00f3n la comisi\u00f3n de riesgos de la EMA ha estado en contacto con las agencias nacionales para recopilar la informaci\u00f3n necesaria, as\u00ed como con las autoridades brit\u00e1nicas, donde la vacunaci\u00f3n va mucho m\u00e1s adelantada y por lo tanto tienen m\u00e1s datos estad\u00edsticos sobre posibles casos de efectos secundarios. La Agencia tambi\u00e9n ha contactado con expertos en trombosis. La Agencia Europea del Medicamento (EMA), tras revisar las pruebas de los casos de trombosis en pacientes que hab\u00edan recibido la vacuna de AstraZeneca, ha dictaminado este jueves que los beneficios de la vacuna superan ampliamente a los riesgos, y recomienda a los Estados miembros que contin\u00faen con la vacunaci\u00f3n, aunque, eso s\u00ed, continuar\u00e1 inverstigando los posibles casos de \"extra\u00f1os\" trombos que se han reportado durante los \u00faltimos d\u00edas. [Trombosis](https://www.elconfidencial.com/tags/otros/trombosis-7962/) [Vacunaci\u00f3n](https://www.elconfidencial.com/tags/temas/vacunacion-16575/) [OMS](https://www.elconfidencial.com/tags/organismos/oms-3845/) - [Historia de un fiasco: crisis de reputaci\u00f3n y 5 millones de dosis de AstraZeneca sin inyectar](https://www.elconfidencial.com/mundo/europa/2021-03-15/coronavirus-covid19-vacuna-astrazeneca-ema_2992839/)Nacho Alarc\u00f3n. Bruselas Dar\u00edo Ojeda - [Pa\u00edses Bajos paraliza la administraci\u00f3n de la vacuna de AstraZeneca](https://www.elconfidencial.com/mundo/europa/2021-03-15/paises-bajos-paraliza-administracion-vacuna-astrazeneca_2991539/)Europa Press - [\u00bfQu\u00e9 pasar\u00eda si toda Espa\u00f1a se pusiera la vacuna de AstraZeneca contra el covid-19?](https://www.elconfidencial.com/espana/coronavirus/2021-03-18/covid19-astrazeneca-vacuna-efectos-adversos_2996120/)Antonio Villarreal Dar\u00edo Ojeda "}