{"title": "Aumenta tu energ\u00eda con esta combinaci\u00f3n de ingredientes y prepara un delicioso jugo natural", "author": "Alejandra Suaste", "url": "https://www.gastrolabweb.com/bebidas/2023/7/25/aumenta-tu-energia-con-esta-combinacion-de-ingredientes-prepara-un-delicioso-jugo-natural-38741.html", "hostname": "gastrolabweb.com", "description": "\u00bfTe sientes cansado? Con este jugo natural podr\u00e1s iniciar la ma\u00f1ana con mucha energ\u00eda", "sitename": "Jugo energizante", "date": "2023-07-25", "cleaned_text": "Bebidas naturales Aumenta tu energ\u00eda con esta combinaci\u00f3n de ingredientes y prepara un delicioso jugo natural\u00bfTe sientes cansado? Con este jugo natural podr\u00e1s iniciar la ma\u00f1ana con mucha energ\u00eda Para esos d\u00edas en los que no has descansado lo suficiente y te sientes con poca energ\u00eda, prepara para el desayuno un delicioso [jugo natural.](https://www.gastrolabweb.com/bebidas/2023/7/24/bebidas-para-el-verano-receta-de-coctel-de-vodka-con-maracuya-38623.html) Esta combinaci\u00f3n de frutas y verduras ser\u00e1 necesario para adquirir los suficientes nutrientes que te aportan vitaminas y minerales. Para esta receta de jugo se requiere de betabel, zanahoria y pi\u00f1a. El [betabel](https://www.gastrolabweb.com/tips/2023/6/26/cubrete-las-canas-con-un-tinte-natural-hecho-con-betabel-asi-lo-preparas-en-casa-facil-37796.html) tambi\u00e9n conocido como remolacha pertenece a la familia de las amarant\u00e1ceas, es una hortaliza que se puede consumir cocida o cruda, es fuente de vitamina C que ayuda a estimular el sistema inmune, contiene minerales como potasio, hierro, magnesio, f\u00f3sforo y cobre. Tambi\u00e9n posee vitaminas del grupo B, vitamina E y vitamina K. Este alimento combate el envejecimiento, mejora la digesti\u00f3n, entre otros. La zanahoria es rica en f\u00f3sforo que ayuda a vigorizar los cuerpos cansados, favorece la digesti\u00f3n, es diur\u00e9tico ayuda a evitar la retenci\u00f3n de l\u00edquidos, fortalece el sistema inmunol\u00f3gico, mejora la vista, protege la dentadura y combate los problemas intestinales. Contiene minerales como potasio, f\u00f3sforo, magnesio, yodo y calcio. As\u00ed como vitamina B3 (niacina), vitamina E y vitamina K y folatos. La combinaci\u00f3n de estas hortalizas junto con la pi\u00f1a, jengibre y lim\u00f3n ayudar\u00e1n a que tu cuerpo se llene de energ\u00eda y el cansancio disminuya. Te decimos c\u00f3mo puedes prepararlo. Toma nota. Jugo energizanteAlejandra Suaste Ingredientes - \u00bd pieza de betabel - 2 zanahorias - 1 rodaja de pi\u00f1a - 1 cm de jengibre - Zumo de un lim\u00f3n - \u00bc de taza de agua Marcas preferentes: Las de tu preferencia. Preparaci\u00f3n - Comienza por lavar muy bien las hortalizas, quita la c\u00e1scara de las zanahorias y del betabel, corta en trozos peque\u00f1os. - Lleva a la licuadora estos ingredientes junto con la pi\u00f1a y el jengibre (previamente pelado). - Procesa hasta que los ingredientes se mezclen, a\u00f1ade un cuarto de taza de agua y procesa nuevamente. - Sirve y bebe al momento. - Si gustas puedes a\u00f1adir un poco de miel de abeja. Informaci\u00f3n Nutricional - Calor\u00edas: 36kcal "}