{"title": "Erika Neumann", "author": "Cristina", "url": "https://namya.es/", "hostname": "namya.es", "description": "Medicina Integrativa", "sitename": "Namya", "date": "2023-07-15", "cleaned_text": "Uniendo lo mejor de la medicina moderna y las terapias complementarias. Puedes leer m\u00e1s sobre la Medicina Integrativa [haciendo click aqu\u00ed.](https://namya.es/que-es-la-medicina-integrativa/) Erika Neumann Medicina integrativa y ayurveda Soy m\u00e9dica graduada de la Universidad de BsAs, realic\u00e9 posgrados en medicina ayurveda, microbiota y medicina familiar, entre otras cosas. Mi idea es ofrecer una mirada hol\u00edstica y natural, integrando la medicina ayurveda y la fitoterapia con la medicina moderna basada en la evidencia cient\u00edfica. Namya Es un t\u00e9rmino en s\u00e1nscrito que habla de una cualidad flexible y adaptable. Mi intenci\u00f3n es ofrecer un espacio terap\u00e9utico adaptado a la persona y pensado para el mundo cambiante en el que vivimos. De curar a sanar Entender a la sanaci\u00f3n como un concepto m\u00e1s amplio e integral que el simple acto de curar. Visi\u00f3n biopsicosocial y espiritual Cada persona es un ser integrado en su entorno y compuesto por una unidad mente-cuerpo-esp\u00edritu. Conexi\u00f3n con lo natural Conectar con la sabidur\u00eda de nuestro cuerpo y los recursos de la naturaleza para mantener o recuperar la salud. \u00bfTienes alguna pregunta? Si tienes dudas antes de reservar una cita o quieres escribirme por otro motivo, puedes contactarme aqu\u00ed. Erika tiene un trato super agradable y cercano. Tiene gran capacidad de escucha y de empatia. Trata de adaptar su tratamiento a tu estilo de vida sin forzarte a nada. Se agradece mucho su escucha, su calidez y humanidad. Con una sola visita ya he mejorado mucho mis problemas digestivos. Estoy encantado y volver\u00e9 para mejorar mi salud general. Estoy encantada con Erika, el trato es exquisito y su profesionalidad es incuestionable. Llevo poco tiempo y ya estoy observando los resultados. Es muy recomendable "}