{"title": "Terapia vitam\u00ednica de hidrataci\u00f3n intravenosa", "author": "Michelle Crouch", "url": "https://www.aarp.org/espanol/salud/farmacos-y-suplementos/info-2022/terapia-de-vitaminas-intravenosa.html", "hostname": "aarp.org", "description": "Los 'bares de goteo' afirman que curan la resaca, aumentan la inmunidad y combaten el envejecimiento, pero los expertos recomiendan precauci\u00f3n.", "sitename": "AARP", "date": "2023-08-29", "cleaned_text": "Terapia vitam\u00ednica de hidrataci\u00f3n intravenosa: \u00bfqu\u00e9 es y realmente funciona? Los 'bares de goteo' afirman que curan la resaca, aumentan la inmunidad y combaten el envejecimiento, pero los expertos recomiendan precauci\u00f3n. En las ciudades de todo el pa\u00eds han surgido los salones IV y los \"drip bars\" (bares de goteo), que prometen infusiones de vitaminas por v\u00eda intravenosa que pueden aumentar la hidrataci\u00f3n, [dar energ\u00eda](/espanol/salud/vida-saludable/info-2022/superalimentos-que-aumentan-la-energia.html), apoyar la salud del sistema inmunitario y combatir los signos del envejecimiento. A diferencia de un goteo intravenoso administrado en un hospital, esta nueva tendencia afirma ayudar a aliviar los s\u00edntomas asociados con la resaca, la fatiga, la gripe, el desfase horario y la deshidrataci\u00f3n. Incluso puedes recibir uno de estos c\u00f3cteles vitam\u00ednicos intravenosos en tu hogar o tu oficina. [Membres\u00eda de AARP: $12 por tu primer a\u00f1o cuando te inscribes en la renovaci\u00f3n autom\u00e1tica.](https://join.aarp.org/orgartjes?intcmp=DSO-MEM-ARTL-JOIN-ES&request_locale=es) Obt\u00e9n acceso inmediato a productos exclusivos para socios y cientos de descuentos, una segunda membres\u00eda gratis y una suscripci\u00f3n a AARP The Magazine. \u00bfFunciona la hidrataci\u00f3n intravenosa? Una infusi\u00f3n intravenosa puede salvar la vida de un paciente muy [deshidratado](/espanol/salud/enfermedades-y-tratamientos/info-2021/sintomas-senales-de-deshidratacion.html), con [carencia de nutrientes](/espanol/salud/enfermedades-y-tratamientos/info-2023/sintomas-de-deficiencia-nutricional.html) o que sufre una infecci\u00f3n masiva. Pero muchos expertos afirman que no hay raz\u00f3n para someterse a lo que es esencialmente un tratamiento invasivo a menos que un m\u00e9dico lo recomiende. \"La hidrataci\u00f3n por v\u00eda intravenosa es excelente para las personas que realmente la necesitan\", explica el Dr. Robert H. Shmerling, editor s\u00e9nior de Harvard Health Publishing, que ha investigado la terapia intravenosa. \"Cuando se trata de estos sueros a la carta, la respuesta corta es que hay que actuar con precauci\u00f3n. Son caros y no son claramente \u00fatiles desde el punto de vista cient\u00edfico\". Aunque es cierto que una infusi\u00f3n puede hidratarte m\u00e1s r\u00e1pido que beber l\u00edquidos, dice Shmerling, \"eso no se traduce necesariamente en ning\u00fan tipo de beneficio para la salud\". Si est\u00e1s demasiado enfermo o eres demasiado mayor para beber el volumen de l\u00edquido que tu cuerpo necesita, entonces debes ingresar en un centro m\u00e9dico, agrega. \u00bfCu\u00e1les son los posibles beneficios de un goteo vitam\u00ednico intravenoso? Sus defensores afirman que la terapia intravenosa es eficaz porque evita el sistema digestivo y suministra hidrataci\u00f3n, nutrientes y minerales directamente al torrente sangu\u00edneo. Algunas celebridades \u2014como Jane Fonda, Lily Tomlin, Adele, Chrissy Teigen y John Legend\u2014 han utilizado la terapia intravenosa (IV) como parte de sus rutinas de bienestar. Sin embargo, las promesas de la terapia intravenosa van m\u00e1s all\u00e1 de la simple hidrataci\u00f3n. En la mayor\u00eda de las cl\u00ednicas, puedes elegir entre una variedad de brebajes, en funci\u00f3n de tu meta. Hay diferentes c\u00f3cteles para curar la resaca, [reforzar el sistema inmunitario](/espanol/salud/vida-saludable/info-2021/superalimentos-para-fortalecer-sistema-inmune.html), aumentar la energ\u00eda, ayudar a la recuperaci\u00f3n tras el entrenamiento, tratar el desfase horario, mejorar la piel, eliminar las toxinas y revertir los signos del envejecimiento. Sin embargo, hay pocas pruebas que respalden cualquiera de estos beneficios. Uno de los pocos estudios cl\u00ednicos controlados que analizaron la terapia vitam\u00ednica intravenosa en comparaci\u00f3n con un placebo descubri\u00f3 que los [pacientes con fibromialgia](https://www.ncbi.nlm.nih.gov/pmc/articles/PMC2894814/) (en ingl\u00e9s) informaron una menor sensibilidad y dolor despu\u00e9s de recibir una infusi\u00f3n espec\u00edfica llamada \"c\u00f3ctel de Myers\", una mezcla de magnesio, calcio y vitaminas C y B inventada por un m\u00e9dico llamado John Myers. Pero esta es la cuesti\u00f3n: los pacientes del estudio a los que se les inyect\u00f3 solo una soluci\u00f3n salina informaron los mismos resultados positivos, un signo de \"un fuerte efecto placebo\", escribieron los autores del estudio. Las cl\u00ednicas no est\u00e1n reguladas por la FDA Es importante saber que los salones IV y los bares de goteo no est\u00e1n regulados por la Administraci\u00f3n de Alimentos y Medicamentos (FDA). \"Su comercializaci\u00f3n se ha adelantado mucho a la ciencia\", dice Shmerling. De hecho, la mayor\u00eda de las cl\u00ednicas incluyen alguna variaci\u00f3n de este descargo de responsabilidad en su sitio web y en los materiales de mercadeo: \"Los servicios que se prestan no han sido evaluados por la Administraci\u00f3n de Alimentos y Medicamentos [...]. Cualquier designaci\u00f3n o referencia a las terapias es solo para fines de mercadeo\". \u00bfCu\u00e1les son las desventajas, los efectos secundarios y los riesgos? Los expertos dicen que hay pocas pruebas cient\u00edficas que respalden los tratamientos vitam\u00ednicos intravenosos. Tambi\u00e9n advierten que el goteo intravenoso m\u00e9dicamente innecesario podr\u00eda ser arriesgado para algunas personas, en particular para quienes padecen [enfermedades card\u00edacas](/espanol/salud/enfermedades-y-tratamientos/info-2022/sintomas-enfermedades-del-corazon.html) o [problemas renales](/espanol/salud/enfermedades-y-tratamientos/info-2021/sintomas-senales-enfermedad-renal.html). Para esas personas, la administraci\u00f3n de l\u00edquidos con demasiada rapidez podr\u00eda ser perjudicial porque su \"coraz\u00f3n o sus ri\u00f1ones no pueden tolerar que se introduzcan grandes cantidades de sal y l\u00edquidos en su organismo\", explica el Dr. Sam Torbati, codirector del Departamento de Medicina de Urgencias del Centro M\u00e9dico Cedars-Sinai en Los \u00c1ngeles. \"Desde el punto de vista m\u00e9dico, es donde hay m\u00e1s potencial de da\u00f1o\". Recomienda consultar con tu m\u00e9dico antes de visitar una cl\u00ednica de goteo. Si decides probar la terapia intravenosa, aseg\u00farate de recibir el tratamiento en un entorno seguro y limpio. Pregunta tambi\u00e9n qui\u00e9n te administrar\u00e1 la infusi\u00f3n y cu\u00e1nta experiencia tiene, aconseja Torbati. Dado que te colocan una aguja en el brazo, existe la posibilidad de que te cause dolor o hematomas o, en casos aislados, de que se produzca una infecci\u00f3n o una inflamaci\u00f3n de la vena. Los pacientes de edad avanzada suelen tener las venas m\u00e1s peque\u00f1as, por lo que la colocaci\u00f3n de una v\u00eda intravenosa en alguien mayor de 65 a\u00f1os es m\u00e1s dif\u00edcil que en una persona m\u00e1s joven. \"Cuanto m\u00e1s fr\u00e1gil te encuentres desde el punto de vista m\u00e9dico, m\u00e1s cauteloso deber\u00edas ser a la hora de probar estas cosas\", recomienda Torbati. Tambi\u00e9n es importante preguntar exactamente qu\u00e9 sustancias se introducir\u00e1n en tu organismo. Algunos goteros tienen medicamentos antiinflamatorios o contra las n\u00e1useas que podr\u00edan causar una reacci\u00f3n al\u00e9rgica o [interactuar con los medicamentos que el paciente est\u00e1 tomando](/espanol/salud/farmacos-y-suplementos/info-2022/peligros-de-mezclar-medicinas-y-vitaminas.html), dice Torbati. Otras infusiones incluyen medicamentos recetados, como el ketorolaco y la lidoca\u00edna, que podr\u00edan provocar efectos adversos potencialmente mortales en algunos pacientes, seg\u00fan un estudio del 2014 publicado en la revista Journal of Parenteral and Enteral Nutrition. En el 2018, la supermodelo Kendall Jenner fue hospitalizada despu\u00e9s de una mala reacci\u00f3n a un goteo intravenoso de vitaminas del c\u00f3ctel de Myers, seg\u00fan las noticias. \u00bfCu\u00e1nto dura la terapia vitam\u00ednica intravenosa en el cuerpo? El tratamiento en s\u00ed puede tomar entre 30 minutos y dos horas por sesi\u00f3n, dependiendo de la persona y del goteo intravenoso seleccionado. La mayor\u00eda de las cl\u00ednicas afirman que el fluido intravenoso permanece en el cuerpo durante unas horas, mientras que los nutrientes pueden permanecer en el organismo durante d\u00edas, semanas o incluso meses. En conclusi\u00f3n: \"La terapia vitam\u00ednica intravenosa no tiene sentido\", dice Edward Boyer, m\u00e9dico de emergencias, profesor permanente en el Centro M\u00e9dico Wexner de la Universidad Estatal de Ohio y profesor visitante en la Facultad de Medicina de Harvard. \"Esto se debe a que las vitaminas son eficaces en concentraciones muy bajas, en receptores muy espec\u00edficos\". \u00bfCu\u00e1nto cuesta la terapia de infusi\u00f3n de vitaminas? El costo de un suero vitam\u00ednico oscila entre $79, el precio promocional para la primera infusi\u00f3n en algunas cl\u00ednicas, hasta los miles de d\u00f3lares por un c\u00f3ctel especial entregado a domicilio por un proveedor m\u00f3vil. Aunque los goteos intravenosos son de bajo riesgo para la mayor\u00eda de las personas saludables, los expertos m\u00e9dicos suelen desaconsejarlos, sobre todo porque son muy caros e innecesarios. \"No hay nada m\u00e1gico en recibir vitaminas por v\u00eda intravenosa\", explica Torbati. \"Si quieres nutrici\u00f3n extra, toma una vitamina. Si te duele la cabeza, toma ibuprofeno. En vez de gastar cientos de d\u00f3lares en una infusi\u00f3n intravenosa, puedes gastar 5 centavos en una p\u00edldora y obtener el mismo beneficio\". Michelle Crouch es una escritora colaboradora que ha cubierto temas de salud y finanzas personales para algunas de las principales publicaciones para consumidores del pa\u00eds. Su trabajo se public\u00f3 en Reader's Digest, Real Simple, Prevention, The Washington Post y The New York Times. "}